,tweet_id,timestamp,text,expanded_urls,rating_numerator,rating_denominator,name,tweet_source,dog_stage,jpg_url,img_num,dog_breed,p_conf,retweet_count,favorite_count
975,716730379797970944,2016-04-03 20:53:33+00:00,"There has clearly been a mistake. Pup did nothing wrong. 12/10 would help escape
https://t.co/Juid3nnLbC",https://twitter.com/chpsanfrancisco/status/716637124322177024,12.0,10.0,none,Twitter for iPhone,,,,,,397,1139
976,716447146686459905,2016-04-03 02:08:05+00:00,This is Ozzy. He's acrobatic af. Legendary pupper status achieved. 13/10 https://t.co/gHWsCTu90E,https://vine.co/v/eMmXVPn5eQK,13.0,10.0,ozzy,Vine - Make a Scene,pupper,,,,,5342,12059
977,716439118184652801,2016-04-03 01:36:11+00:00,This is Bluebert. He just saw that both #FinalFur match ups are split 50/50. Amazed af. 11/10 https://t.co/Kky1DPG4iq,https://twitter.com/dog_rates/status/716439118184652801/photo/1,11.0,10.0,bluebert,Twitter for iPhone,,https://pbs.twimg.com/media/CfFNk7cWAAA-hND.jpg,1.0,Siberian_husky,0.396495,191,2206
978,716285507865542656,2016-04-02 15:25:47+00:00,This is Stephanus. She stays woke. 12/10 https://t.co/WIWabMngQZ,"https://twitter.com/dog_rates/status/716285507865542656/photo/1,https://twitter.com/dog_rates/status/716285507865542656/photo/1",12.0,10.0,stephanus,Twitter for iPhone,,https://pbs.twimg.com/media/CfDB3aJXEAAEZNv.jpg,1.0,Yorkshire_terrier,0.4304199999999999,969,2567
979,716080869887381504,2016-04-02 01:52:38+00:00,Here's a super majestic doggo and a sunset 11/10 https://t.co/UACnoyi8zu,"https://twitter.com/dog_rates/status/716080869887381504/photo/1,https://twitter.com/dog_rates/status/716080869887381504/photo/1",11.0,10.0,none,Twitter for iPhone,doggo,https://pbs.twimg.com/media/CfAHv83UMAIEQYx.jpg,1.0,golden_retriever,0.638625,1717,6270
980,715928423106027520,2016-04-01 15:46:52+00:00,This is Bubbles. He's a Yorkshire Piccolope. 11/10 would snug aggressively https://t.co/3BhMojONxq,https://twitter.com/dog_rates/status/715928423106027520/photo/1,11.0,10.0,bubbles,Twitter for iPhone,,https://pbs.twimg.com/media/Ce99GhLW8AAHG38.jpg,1.0,pug,0.976685,798,2943
981,715758151270801409,2016-04-01 04:30:16+00:00,This is old now but it's absolutely heckin fantastic and I can't not share it with you all. 13/10  https://t.co/wJX74TSgzP,https://vine.co/v/hYdLVKDpAFu,13.0,10.0,old,Vine - Make a Scene,,,,,,1297,3429
982,715733265223708672,2016-04-01 02:51:22+00:00,This is a taco. We only rate dogs. Please only send in dogs. Dogs are what we rate. Not tacos. Thank you... 10/10 https://t.co/cxl6xGY8B9,https://twitter.com/dog_rates/status/715733265223708672/photo/1,10.0,10.0,a,Twitter for iPhone,,https://pbs.twimg.com/media/Ce7LlUeUUAEQkQl.jpg,1.0,Dandie_Dinmont,0.740229,1540,4304
983,715704790270025728,2016-04-01 00:58:13+00:00,This is Bentley. He gives kisses back. 11/10 precious af (vid by @emmaallen25) https://t.co/9PnKkKzoUp,https://vine.co/v/ijAlDnuOD0l,11.0,10.0,bentley,Vine - Make a Scene,,,,,,516,2571
984,715696743237730304,2016-04-01 00:26:15+00:00,Meet Toby. He's a Lithuanian High-Steppin Stickeroo. One of the more accomplished Stickeroos around. 10/10 so nifty https://t.co/cYPHuJYTjC,https://twitter.com/dog_rates/status/715696743237730304/photo/1,10.0,10.0,toby,Twitter for iPhone,,https://pbs.twimg.com/media/Ce6qZC2WAAAcSoI.jpg,1.0,Staffordshire_bullterrier,0.427836,1173,3623
985,715680795826982913,2016-03-31 23:22:53+00:00,This is Zeus. He's downright fabulous. 12/10 https://t.co/sSugyyRuTp,"https://twitter.com/dog_rates/status/715680795826982913/photo/1,https://twitter.com/dog_rates/status/715680795826982913/photo/1,https://twitter.com/dog_rates/status/715680795826982913/photo/1",12.0,10.0,zeus,Twitter for iPhone,,https://pbs.twimg.com/media/Ce6b4MPWwAA22Xm.jpg,1.0,golden_retriever,0.990715,1454,3987
986,715360349751484417,2016-03-31 02:09:32+00:00,This is Bertson. He just wants to say hi. 11/10 would boop nose https://t.co/hwv7Wq6gDA,https://twitter.com/dog_rates/status/715360349751484417/photo/1,11.0,10.0,bertson,Twitter for iPhone,,,,,,1417,5058
987,715342466308784130,2016-03-31 00:58:29+00:00,This is Oscar. He's a world renowned snowball inspector. It's a ruff job but someone has to do it. 10/10 great guy https://t.co/vSufMAKm3C,"https://twitter.com/dog_rates/status/715342466308784130/photo/1,https://twitter.com/dog_rates/status/715342466308784130/photo/1",10.0,10.0,oscar,Twitter for iPhone,,https://pbs.twimg.com/media/Ce1oLNqWAAE34w7.jpg,1.0,West_Highland_white_terrier,0.597111,628,2801
988,715220193576927233,2016-03-30 16:52:36+00:00,This is Nico. His selfie game is strong af. Excellent use of a sneaky tongue slip. 10/10 star material https://t.co/1OBdJkMOFx,https://twitter.com/dog_rates/status/715220193576927233/photo/1,10.0,10.0,nico,Twitter for iPhone,,https://pbs.twimg.com/media/Cez49UqWsAIRQXc.jpg,1.0,Chihuahua,0.584026,594,2227
989,715200624753819648,2016-03-30 15:34:51+00:00,This is Michelangelope. He's half coffee cup. Rare af. 12/10 would hug until someone stopped me https://t.co/tvVDY0G911,https://twitter.com/dog_rates/status/715200624753819648/photo/1,12.0,10.0,michelangelope,Twitter for iPhone,,https://pbs.twimg.com/media/CeznK6IWEAEFUPq.jpg,1.0,Chihuahua,0.956787,1697,4769
990,715009755312439296,2016-03-30 02:56:24+00:00,This is Siba. She's remarkably mobile. Very sleepy as well. 12/10 would happily transport https://t.co/TjnI33RE1i,https://twitter.com/dog_rates/status/715009755312439296/photo/1,12.0,10.0,siba,Twitter for iPhone,,https://pbs.twimg.com/media/Cew5kyOWsAA8Y_o.jpg,1.0,Chihuahua,0.142288,1110,3838
991,714982300363173890,2016-03-30 01:07:18+00:00,This is Calbert. He forgot to clear his Google search history. 9/10 rookie mistake Calbert https://t.co/jRm5J3YCmj,https://twitter.com/dog_rates/status/714982300363173890/photo/1,9.0,10.0,calbert,Twitter for iPhone,,https://pbs.twimg.com/media/CewgnHAXEAAdbld.jpg,1.0,Brittany_spaniel,0.944376,939,3445
992,714962719905021952,2016-03-29 23:49:30+00:00,Just in case anyone's having a bad day. 12/10 would bounce with https://t.co/T9sgP9ttnQ,https://vine.co/v/inVtemLt9tE,12.0,10.0,none,Vine - Make a Scene,,,,,,3856,6777
993,714957620017307648,2016-03-29 23:29:14+00:00,This is Curtis. He's an Albino Haberdasher. Terrified of dandelions. They really spook him up. 10/10 it'll be ok pup https://t.co/s8YcfZrWhK,https://twitter.com/dog_rates/status/714957620017307648/photo/1,10.0,10.0,curtis,Twitter for iPhone,,https://pbs.twimg.com/media/CewKKiOWwAIe3pR.jpg,1.0,Great_Pyrenees,0.2515159999999999,1287,3828
994,714631576617938945,2016-03-29 01:53:39+00:00,This is Benedict. He's a feisty pup. Needs a brushing. Portable af. Looks very angry actually. 4/10 might not pet https://t.co/3oeFfHjv0Z,https://twitter.com/dog_rates/status/714631576617938945/photo/1,4.0,10.0,benedict,Twitter for iPhone,,,,,,903,3023
995,714606013974974464,2016-03-29 00:12:05+00:00,Here are two lil cuddly puppers. Both 12/10 would snug like so much https://t.co/zO4eb7C4tG,https://twitter.com/dog_rates/status/714606013974974464/photo/1,12.0,10.0,none,Twitter for iPhone,,https://pbs.twimg.com/media/CerKYG8WAAM1aE-.jpg,1.0,Norfolk_terrier,0.293007,835,3360
996,714485234495041536,2016-03-28 16:12:09+00:00,This is Blitz. He screams. 10/10 (vid by @yeaahliv) https://t.co/MfW2aym5UF,https://vine.co/v/iDrOvVqq0A6,10.0,10.0,blitz,Vine - Make a Scene,,,,,,1015,2463
997,714258258790387713,2016-03-28 01:10:13+00:00,"Meet Travis and Flurp. Travis is pretty chill but Flurp can't lie down properly. 10/10 &amp; 8/10
get it together Flurp https://t.co/Akzl5ynMmE",https://twitter.com/dog_rates/status/714258258790387713/photo/1,10.0,10.0,travis,Twitter for iPhone,,https://pbs.twimg.com/media/CemOGNjWQAEoN7R.jpg,1.0,collie,0.176758,674,2830
998,714251586676113411,2016-03-28 00:43:43+00:00,This is Thumas. He hates potted plants. 8/10 wtf Thumas https://t.co/rDVueNIcEi,"https://twitter.com/dog_rates/status/714251586676113411/photo/1,https://twitter.com/dog_rates/status/714251586676113411/photo/1",8.0,10.0,thumas,Twitter for iPhone,,https://pbs.twimg.com/media/CemIBt4WwAQqhVV.jpg,2.0,soft-coated_wheaten_terrier,0.751962,766,3037
999,714214115368108032,2016-03-27 22:14:49+00:00,Happy Easter from the squad! ðŸ‡ðŸ¶ 13/10 for all https://t.co/YMx4KWJUAB,https://twitter.com/dog_rates/status/714214115368108032/photo/1,13.0,10.0,none,Twitter for iPhone,,https://pbs.twimg.com/media/Cell8ikWIAACCJ-.jpg,1.0,pug,0.533967,802,2124
1000,714141408463036416,2016-03-27 17:25:54+00:00,"I know we only rate dogs, but since it's Easter I guess we could rate a bunny for a change. 10/10 petable as hell https://t.co/O2RlKXigHu",https://twitter.com/dog_rates/status/714141408463036416/photo/1,10.0,10.0,none,Twitter for iPhone,,https://pbs.twimg.com/media/Cekj0qwXEAAHcS6.jpg,1.0,Labrador_retriever,0.586951,1287,4018
1001,713919462244790272,2016-03-27 02:43:58+00:00,This is Kanu. He's a Freckled Ticonderoga. Simply flawless. 12/10 would perform an elaborate heist to capture https://t.co/7vyAzIURrE,https://twitter.com/dog_rates/status/713919462244790272/photo/1,12.0,10.0,kanu,Twitter for iPhone,,https://pbs.twimg.com/media/CehZ9mLWsAAsn28.jpg,1.0,Siberian_husky,0.4632229999999999,726,3055
1002,713909862279876608,2016-03-27 02:05:49+00:00,This is Doug. His nose is legendary af. 12/10 (vid by @probably_trey) https://t.co/7IWKfbfihS,https://vine.co/v/iDWlapaXWmm,12.0,10.0,doug,Vine - Make a Scene,,,,,,490,1758
1003,713900603437621249,2016-03-27 01:29:02+00:00,Happy Saturday here's 9 puppers on a bench. 99/90 good work everybody https://t.co/mpvaVxKmc1,https://twitter.com/dog_rates/status/713900603437621249/photo/1,11.0,10.0,none,Twitter for iPhone,,https://pbs.twimg.com/media/CehIzzZWQAEyHH5.jpg,1.0,golden_retriever,0.371816,666,2631
1004,713761197720473600,2016-03-26 16:15:05+00:00,This is Piper. She would really like that tennis ball core. Super sneaky tongue slip. 12/10 precious af https://t.co/QP6GHi5az9,"https://twitter.com/dog_rates/status/713761197720473600/photo/1,https://twitter.com/dog_rates/status/713761197720473600/photo/1",12.0,10.0,piper,Twitter for iPhone,,https://pbs.twimg.com/media/CefKBOuWIAAIlKD.jpg,1.0,Brittany_spaniel,0.797936,1246,4482
1005,713411074226274305,2016-03-25 17:03:49+00:00,Here we see an extremely rare Bearded Floofmallow. Only a few left in the wild. 11/10 would pet with a purpose https://t.co/jVJJKlPbvq,https://twitter.com/dog_rates/status/713411074226274305/photo/1,11.0,10.0,none,Twitter for iPhone,,https://pbs.twimg.com/media/CeaLlAPUMAIcC7U.jpg,1.0,Great_Pyrenees,0.720337,1193,4107
1006,713177543487135744,2016-03-25 01:35:51+00:00,This is Lance. Lance doesn't give a shit. 10/10 we should all be more like Lance https://t.co/SqnG9Ap28J,https://twitter.com/dog_rates/status/713177543487135744/photo/1,10.0,10.0,lance,Twitter for iPhone,,https://pbs.twimg.com/media/CeW3MWMWQAEOMbq.jpg,1.0,whippet,0.734244,2606,6671
1007,713175907180089344,2016-03-25 01:29:21+00:00,Say hello to Opie and Clarkus. Clarkus fell asleep so Opie buried him. Ruthless af 10/10 for both https://t.co/xT7XaY4gnW,https://twitter.com/dog_rates/status/713175907180089344/photo/1,10.0,10.0,opie,Twitter for iPhone,,https://pbs.twimg.com/media/CeW1tERWAAAA9Q2.jpg,1.0,malamute,0.4306239999999999,1340,4105
1008,712809025985978368,2016-03-24 01:11:29+00:00,This is Stubert. He just arrived. 10/10 https://t.co/HVGs5aAKAn,https://twitter.com/dog_rates/status/712809025985978368/photo/1,10.0,10.0,stubert,Twitter for iPhone,,https://pbs.twimg.com/media/CeRoBaxWEAABi0X.jpg,1.0,Labrador_retriever,0.8686709999999999,6115,17615
1009,712717840512598017,2016-03-23 19:09:09+00:00,Please don't send in any more polar bears. We only rate dogs. Thank you... 10/10 https://t.co/83RGhdIQz2,https://twitter.com/dog_rates/status/712717840512598017/photo/1,10.0,10.0,none,Twitter for iPhone,,https://pbs.twimg.com/media/CeQVF1eVIAAJaTv.jpg,1.0,Great_Pyrenees,0.732043,4528,11372
1010,712668654853337088,2016-03-23 15:53:42+00:00,Say hello to Sunny and Roxy. They pull things out of water together. 10/10 for both https://t.co/88aedAmxcl,"https://twitter.com/dog_rates/status/712668654853337088/photo/1,https://twitter.com/dog_rates/status/712668654853337088/photo/1,https://twitter.com/dog_rates/status/712668654853337088/photo/1",10.0,10.0,sunny,Twitter for iPhone,,https://pbs.twimg.com/media/CePoVTyWsAQEz1g.jpg,1.0,Labrador_retriever,0.829058,1106,3843
1011,712438159032893441,2016-03-23 00:37:48+00:00,This is Kane. He's a semi-submerged Haitian Huffleplop. Happy af. Sick waterfall. 11/10 would pat head approvingly https://t.co/7zjEC501Ul,https://twitter.com/dog_rates/status/712438159032893441/photo/1,11.0,10.0,kane,Twitter for iPhone,,https://pbs.twimg.com/media/CeMWubMWwAA6GwF.jpg,1.0,Great_Pyrenees,0.069457,1425,4927
1012,712309440758808576,2016-03-22 16:06:19+00:00,"Reminder that we made our first set of stickers available! All are 12/10 would stick
Use code ""pupper"" at checkoutðŸ¶

https://t.co/kJIMNyMNKV",https://twitter.com/stickergrub/status/709919141004595201,12.0,10.0,none,Twitter for iPhone,pupper,,,,,24,222
1013,712097430750289920,2016-03-22 02:03:52+00:00,I can't even comprehend how confused this dog must be right now. 10/10 https://t.co/8AGcQ4hIfK,https://twitter.com/dog_rates/status/712097430750289920/photo/1,10.0,10.0,none,Twitter for iPhone,,https://pbs.twimg.com/media/CeHg1klW8AE4YOB.jpg,1.0,Labrador_retriever,0.720481,943,3479
1014,712092745624633345,2016-03-22 01:45:15+00:00,This is Steven. He's inverted af. Also very helpful. Scans anything you want for free. Takes him a while tho. 7/10 https://t.co/tA0ZiQ7JcG,https://twitter.com/dog_rates/status/712092745624633345/photo/1,7.0,10.0,steven,Twitter for iPhone,,,,,,815,2720
1015,712085617388212225,2016-03-22 01:16:55+00:00,"Say hello to Olive and Ruby. They are best buddies. Both 11/10 
1 like = 1 buddy https://t.co/yagmFdKlyL","https://twitter.com/dog_rates/status/712085617388212225/photo/1,https://twitter.com/dog_rates/status/712085617388212225/photo/1,https://twitter.com/dog_rates/status/712085617388212225/photo/1",11.0,10.0,olive,Twitter for iPhone,,https://pbs.twimg.com/media/CeHWFksXIAAyypp.jpg,2.0,Shih-Tzu,0.625129,442,3029
1016,712065007010385924,2016-03-21 23:55:01+00:00,This is Chester. He's clearly in charge of the other dogs. Weird ass paws. Not fit for fetch. 6/10 would still pet https://t.co/o2GvskrhHt,https://twitter.com/dog_rates/status/712065007010385924/photo/1,6.0,10.0,chester,Twitter for iPhone,,,,,,570,2082
1017,711968124745228288,2016-03-21 17:30:03+00:00,Meet Winston. He's trapped in a cup of coffee. Poor pupper. 10/10 someone free him https://t.co/2e6cUtKUuc,https://twitter.com/dog_rates/status/711968124745228288/photo/1,10.0,10.0,winston,Twitter for iPhone,pupper,,,,,2102,7443
1018,711743778164514816,2016-03-21 02:38:34+00:00,Meet Roosevelt. He's calculating the best case scenario if he drops out instead of doing math hw. 11/10 relatable af https://t.co/QcSIRDpfVg,https://twitter.com/dog_rates/status/711743778164514816/photo/1,11.0,10.0,roosevelt,Twitter for iPhone,,https://pbs.twimg.com/media/CeCfMPDW0AAAEUj.jpg,1.0,Lakeland_terrier,0.4595149999999999,913,2629
1019,711732680602345472,2016-03-21 01:54:29+00:00,I want to hear the joke this dog was just told. 10/10 https://t.co/1KiuZqqOD4,"https://twitter.com/dog_rates/status/711732680602345472/photo/1,https://twitter.com/dog_rates/status/711732680602345472/photo/1,https://twitter.com/dog_rates/status/711732680602345472/photo/1",10.0,10.0,none,Twitter for iPhone,,https://pbs.twimg.com/media/CeCVGEbUYAASeY4.jpg,3.0,Ibizan_hound,0.334929,3711,8122
1020,711694788429553666,2016-03-20 23:23:54+00:00,Oh. My. God. 13/10 magical af https://t.co/Ezu6jQrKAZ,https://twitter.com/dog_rates/status/711694788429553666/photo/1,13.0,10.0,none,Twitter for iPhone,,,,,,16703,30381
1021,711652651650457602,2016-03-20 20:36:28+00:00,This is Gary. He just wanted to say hi. 9/10 very personable pup https://t.co/Sk3CbhmKSW,https://twitter.com/dog_rates/status/711652651650457602/photo/1,9.0,10.0,gary,Twitter for iPhone,,,,,,825,3564
1022,711363825979756544,2016-03-20 01:28:47+00:00,"""Please, no puparazzi"" 11/10 https://t.co/nJIXSPfedK","https://twitter.com/dog_rates/status/711363825979756544/photo/1,https://twitter.com/dog_rates/status/711363825979756544/photo/1",11.0,10.0,none,Twitter for iPhone,,https://pbs.twimg.com/media/Cd9Fn5QUMAAYMT4.jpg,1.0,Pembroke,0.7509060000000001,1022,3335
1023,711306686208872448,2016-03-19 21:41:44+00:00,What hooligan sent in pictures w/out a dog in them? Churlish af. 3/10 just bc that's a neat fluffy bean bag chair https://t.co/wcwoGOkZvz,"https://twitter.com/dog_rates/status/711306686208872448/photo/1,https://twitter.com/dog_rates/status/711306686208872448/photo/1",3.0,10.0,none,Twitter for iPhone,,https://pbs.twimg.com/media/Cd8Rpl0W0AAN1kU.jpg,1.0,Dandie_Dinmont,0.0867925,681,3063
1024,711008018775851008,2016-03-19 01:54:56+00:00,This is Chuckles. He had a balloon but he accidentally let go of it and it floated away. 11/10 hang in there pupper https://t.co/68iNM7B5gW,https://twitter.com/dog_rates/status/711008018775851008/photo/1,11.0,10.0,chuckles,Twitter for iPhone,pupper,https://pbs.twimg.com/media/Cd4CBQFW8AAY3ND.jpg,1.0,French_bulldog,0.731405,560,2757
1025,710997087345876993,2016-03-19 01:11:29+00:00,Meet Milo and Amos. They are the best of pals. Both 12/10 would pet at the same time https://t.co/Mv37BHEyyD,https://twitter.com/dog_rates/status/710997087345876993/photo/1,12.0,10.0,milo,Twitter for iPhone,,https://pbs.twimg.com/media/Cd34FClUMAAnvGP.jpg,1.0,malamute,0.28126,1271,4235
1026,710844581445812225,2016-03-18 15:05:29+00:00,This is Staniel. His selfie game is strong af. 10/10 I'd snapchat with Staniel https://t.co/UgkTw7TKyM,https://twitter.com/dog_rates/status/710844581445812225/photo/1,10.0,10.0,staniel,Twitter for iPhone,,https://pbs.twimg.com/media/Cd1tYGmXIAAoW5b.jpg,1.0,Pembroke,0.200407,618,2359
1027,710833117892898816,2016-03-18 14:19:56+00:00,Say hello to Sora. She's an Egyptian Pumpernickel. Mesmerizing af. 12/10 would bring home to mom https://t.co/PmTR4kxZkq,https://twitter.com/dog_rates/status/710833117892898816/photo/1,12.0,10.0,sora,Twitter for iPhone,,https://pbs.twimg.com/media/Cd1i8qvUkAE-Jlr.jpg,1.0,Pembroke,0.803742,481,2482
1028,710658690886586372,2016-03-18 02:46:49+00:00,Here's a brigade of puppers. All look very prepared for whatever happens next. 80/80 https://t.co/0eb7R1Om12,https://twitter.com/dog_rates/status/710658690886586372/photo/1,10.0,10.0,none,Twitter for iPhone,,https://pbs.twimg.com/media/CdzETn4W4AAVU5N.jpg,1.0,soft-coated_wheaten_terrier,0.948617,517,2147
1029,710609963652087808,2016-03-17 23:33:12+00:00,I've watched this a million times and you probably will too. 12/10 (vid by @emily_galasso) https://t.co/DU7Rb3NDiy,https://vine.co/v/idaTpwH5TgU,12.0,10.0,none,Vine - Make a Scene,,,,,,2167,4450
1030,710588934686908417,2016-03-17 22:09:38+00:00,This is Beemo. He's a Chubberflop mix. 12/10 would cross the world for https://t.co/kzMVMU8HBV,"https://twitter.com/dog_rates/status/710588934686908417/photo/1,https://twitter.com/dog_rates/status/710588934686908417/photo/1,https://twitter.com/dog_rates/status/710588934686908417/photo/1,https://twitter.com/dog_rates/status/710588934686908417/photo/1",12.0,10.0,beemo,Twitter for iPhone,,https://pbs.twimg.com/media/CdyE2x1W8AAe0TG.jpg,4.0,Pembroke,0.982004,1708,4191
1031,710296729921429505,2016-03-17 02:48:31+00:00,This is Oshie. 12/10 please enjoy (vid by @catherinec1389) https://t.co/VmtzwAuotq,https://vine.co/v/iw9hUFAMerV,12.0,10.0,oshie,Vine - Make a Scene,,,,,,672,2210
1032,710283270106132480,2016-03-17 01:55:02+00:00,This is Gunner. He's a Figamus Newton. King of the peek-a-boo. Cool jeans. 11/10 https://t.co/ONuBILIYXZ,"https://twitter.com/dog_rates/status/710283270106132480/photo/1,https://twitter.com/dog_rates/status/710283270106132480/photo/1",11.0,10.0,gunner,Twitter for iPhone,,https://pbs.twimg.com/media/Cdtu3WRUkAAsRVx.jpg,2.0,Shih-Tzu,0.932401,482,2005
1033,710272297844797440,2016-03-17 01:11:26+00:00,We ðŸ‘ðŸ» only ðŸ‘ðŸ» rate ðŸ‘ðŸ» dogs. Pls stop sending in non-canines like this Dutch Panda Worm. This is infuriating. 11/10 https://t.co/odfLzBonG2,https://twitter.com/dog_rates/status/710272297844797440/photo/1,11.0,10.0,infuriating,Twitter for iPhone,,https://pbs.twimg.com/media/Cdtk414WoAIUG0v.jpg,1.0,Old_English_sheepdog,0.586307,1149,4157
1034,710269109699739648,2016-03-17 00:58:46+00:00,"The squad is back for St. Patrick's Day! â˜˜ ðŸ’š
13/10 for all https://t.co/OcCDb2bng5",https://twitter.com/dog_rates/status/710269109699739648/photo/1,13.0,10.0,none,Twitter for iPhone,,https://pbs.twimg.com/media/Cdth_KyWEAEXH3u.jpg,1.0,pug,0.415495,1020,2208
1035,710153181850935296,2016-03-16 17:18:07+00:00,This is Lacy. She's tipping her hat to you. Daydreams of her life back on the frontier. 11/10 would pet so well https://t.co/fG5Pk3Et1I,"https://twitter.com/dog_rates/status/710153181850935296/photo/1,https://twitter.com/dog_rates/status/710153181850935296/photo/1",11.0,10.0,lacy,Twitter for iPhone,,https://pbs.twimg.com/media/Cdr4jO2UAAAIo6W.jpg,2.0,cocker_spaniel,0.00271296,816,2695
1036,710140971284037632,2016-03-16 16:29:35+00:00,This is Tater. His underbite is fierce af. Doesn't give a damn about your engagement photo. 8/10 https://t.co/nLuPY3pY12,https://twitter.com/dog_rates/status/710140971284037632/photo/1,8.0,10.0,tater,Twitter for iPhone,,https://pbs.twimg.com/media/Cdrtcr-W4AAqi5H.jpg,1.0,Pekinese,0.95317,809,2529
1037,710117014656950272,2016-03-16 14:54:24+00:00,This pupper got her hair chalked for her birthday. Hasn't told her parents yet. Rebellious af. 11/10 very nifty https://t.co/h1OX2mLtxV,"https://twitter.com/dog_rates/status/710117014656950272/photo/1,https://twitter.com/dog_rates/status/710117014656950272/photo/1",11.0,10.0,none,Twitter for iPhone,pupper,https://pbs.twimg.com/media/CdrXp9dWoAAcRfn.jpg,2.0,toy_poodle,0.802092,1789,5047
1038,709918798883774466,2016-03-16 01:46:45+00:00,Meet Watson. He's a Suzuki Tickleboop. Leader of a notorious biker gang. Only one ear functional. 12/10 snuggable af https://t.co/R1gLc5vDqG,"https://twitter.com/dog_rates/status/709918798883774466/photo/1,https://twitter.com/dog_rates/status/709918798883774466/photo/1",12.0,10.0,watson,Twitter for iPhone,,https://pbs.twimg.com/media/CdojYQmW8AApv4h.jpg,2.0,Pembroke,0.956222,1000,3240
1039,709901256215666688,2016-03-16 00:37:03+00:00,"WeRateDogs stickers are here and they're 12/10! Use code ""puppers"" at checkout ðŸ¶ðŸ¾

Shop now: https://t.co/k5xsufRKYm https://t.co/ShXk46V13r","http://goo.gl/ArWZfi,https://twitter.com/dog_rates/status/709901256215666688/photo/1,https://twitter.com/dog_rates/status/709901256215666688/photo/1,https://twitter.com/dog_rates/status/709901256215666688/photo/1,https://twitter.com/dog_rates/status/709901256215666688/photo/1",12.0,10.0,none,Twitter for iPhone,,,,,,93,609
1040,709852847387627521,2016-03-15 21:24:41+00:00,*lets out a tiny whimper and then collapses* ...12/10 https://t.co/BNdVZEHRow,"https://twitter.com/dog_rates/status/709852847387627521/photo/1,https://twitter.com/dog_rates/status/709852847387627521/photo/1,https://twitter.com/dog_rates/status/709852847387627521/photo/1,https://twitter.com/dog_rates/status/709852847387627521/photo/1",12.0,10.0,none,Twitter for iPhone,,https://pbs.twimg.com/media/CdnnZhhWAAEAoUc.jpg,2.0,Chihuahua,0.945629,1095,3245
1041,709566166965075968,2016-03-15 02:25:31+00:00,This is Olaf. He's gotta be rare. Seems sturdy. Tail is floofy af. 12/10 would do whatever it takes to pet https://t.co/E9jaU59bh9,https://twitter.com/dog_rates/status/709566166965075968/photo/1,12.0,10.0,olaf,Twitter for iPhone,,https://pbs.twimg.com/media/Cdjiqi6XIAIUOg-.jpg,1.0,chow,0.999837,1081,3267
1042,709556954897764353,2016-03-15 01:48:55+00:00,This is Cecil. She's a Gigglefloof Poofer. Outdoorsy af. One with nature. 12/10 would strategically capture https://t.co/ijJB0DuOIC,"https://twitter.com/dog_rates/status/709556954897764353/photo/1,https://twitter.com/dog_rates/status/709556954897764353/photo/1,https://twitter.com/dog_rates/status/709556954897764353/photo/1",12.0,10.0,cecil,Twitter for iPhone,,https://pbs.twimg.com/media/CdjaSFCWAAAJZh3.jpg,2.0,golden_retriever,0.790026,977,3029
1043,709519240576036864,2016-03-14 23:19:03+00:00,This is Vince. He's a Gregorian Flapjeck. White spot on legs almost looks like another dog (whoa). 9/10 rad as hell https://t.co/aczGAV2dK4,https://twitter.com/dog_rates/status/709519240576036864/photo/1,9.0,10.0,vince,Twitter for iPhone,,https://pbs.twimg.com/media/Cdi3-f7W8AUOm9T.jpg,1.0,cocker_spaniel,0.4149819999999999,219,1390
1044,709449600415961088,2016-03-14 18:42:20+00:00,Meet Karma. She's just a head. Lost body during the Second Punic War (unfortunate). Loves to travel 10/10 petable af https://t.co/c6af6nYEPo,"https://twitter.com/dog_rates/status/709449600415961088/photo/1,https://twitter.com/dog_rates/status/709449600415961088/photo/1",10.0,10.0,karma,Twitter for iPhone,,https://pbs.twimg.com/media/Cdh4pgAW0AEKJ_a.jpg,2.0,Maltese_dog,0.780187,520,2032
1045,709409458133323776,2016-03-14 16:02:49+00:00,This is Billy. He sensed a squirrel. 8/10 damn it Billy https://t.co/Yu0K98VZ9A,https://twitter.com/dog_rates/status/709409458133323776/photo/1,8.0,10.0,billy,Twitter for iPhone,,https://pbs.twimg.com/media/CdhUIMSUIAA4wYK.jpg,1.0,Shetland_sheepdog,0.79745,619,2433
1046,709225125749587968,2016-03-14 03:50:21+00:00,This is Walker. He's a Butternut Khalifa. Appears fuzzy af. 11/10 would hug for a ridiculous amount of time https://t.co/k6fEWHSALn,https://twitter.com/dog_rates/status/709225125749587968/photo/1,11.0,10.0,walker,Twitter for iPhone,,https://pbs.twimg.com/media/Cdese-zWEAArIqE.jpg,1.0,Labrador_retriever,0.271109,523,2217
