,tweet_id,timestamp,text,expanded_urls,rating_numerator,rating_denominator,name,tweet_source,dog_stage,jpg_url,img_num,dog_breed,p_conf,retweet_count,favorite_count
499,790946055508652032,2016-10-25 16:00:09+00:00,This is Betty. She's assisting with the dishes. Such a good puppo. 12/10 h*ckin helpful af https://t.co/dgvTPZ9tgI,https://twitter.com/dog_rates/status/790946055508652032/photo/1,12.0,10.0,betty,Twitter for iPhone,puppo,https://pbs.twimg.com/media/CvoBPWRWgAA4het.jpg,1.0,golden_retriever,0.245773,4401,15895
500,790698755171364864,2016-10-24 23:37:28+00:00,This is Mosby. He appears to be rather h*ckin snuggable af. 12/10 keep it up Mosby https://t.co/IiiBq460I7,https://twitter.com/dog_rates/status/790698755171364864/photo/1,12.0,10.0,mosby,Twitter for iPhone,,https://pbs.twimg.com/media/CvkgUjbUsAEvo7l.jpg,1.0,Bernese_mountain_dog,0.996541,1813,7815
501,790581949425475584,2016-10-24 15:53:19+00:00,This is Duke. He sneaks into the fridge sometimes. It's his safe place. 11/10 would give little jacket if necessary https://t.co/Fd5WFDTMH4,"https://twitter.com/dog_rates/status/790581949425475584/photo/1,https://twitter.com/dog_rates/status/790581949425475584/photo/1",11.0,10.0,duke,Twitter for iPhone,,https://pbs.twimg.com/media/Cvi2FiKWgAAif1u.jpg,2.0,malinois,0.000152999,6668,19618
502,790337589677002753,2016-10-23 23:42:19+00:00,Meet Maggie. She can hear your cells divide. 12/10 can also probably fly https://t.co/ovE2hqXryV,https://twitter.com/dog_rates/status/790337589677002753/photo/1,12.0,10.0,maggie,Twitter for iPhone,,https://pbs.twimg.com/media/CvfX2AnWYAAQTay.jpg,1.0,Pembroke,0.658808,1771,7432
503,790277117346975746,2016-10-23 19:42:02+00:00,This is Bruce. He never backs down from a challenge. 11/10 you got this Bruce https://t.co/aI7umZHIq7,https://twitter.com/dog_rates/status/790277117346975746/photo/1,11.0,10.0,bruce,Twitter for iPhone,,https://pbs.twimg.com/media/Cveg1-NXgAASaaT.jpg,1.0,Labrador_retriever,0.427742,2966,11927
504,789986466051088384,2016-10-23 00:27:05+00:00,This is Happy. He's a bathtub reviewer. Seems to be pleased with this one. 12/10 https://t.co/Ln89R4FP7v,https://twitter.com/dog_rates/status/789986466051088384/photo/1,12.0,10.0,happy,Twitter for iPhone,,https://pbs.twimg.com/media/CvaYgDOWgAEfjls.jpg,1.0,golden_retriever,0.0785304999999999,2154,8822
505,789903600034189313,2016-10-22 18:57:48+00:00,This is Ralphy. His dreams were just shattered. Poor pupper. 13/10 it'll be ok Ralphy https://t.co/P0kSN6rT6H,https://vine.co/v/5wPT1aBxPQZ,13.0,10.0,ralphy,Vine - Make a Scene,pupper,,,,,3890,9805
506,789628658055020548,2016-10-22 00:45:17+00:00,This is Eli. He can fly. 13/10 magical af https://t.co/huPSJJ7FDI,https://twitter.com/dog_rates/status/789628658055020548/photo/1,13.0,10.0,eli,Twitter for iPhone,,https://pbs.twimg.com/media/CvVTEnPXYAAWLyL.jpg,1.0,chow,0.260702,1654,7094
507,789599242079838210,2016-10-21 22:48:24+00:00,This is Brownie. She's wearing a Halloween themed onesie. 12/10 festive af https://t.co/0R4meWXFOx,"https://twitter.com/dog_rates/status/789599242079838210/photo/1,https://twitter.com/dog_rates/status/789599242079838210/photo/1",12.0,10.0,brownie,Twitter for iPhone,,https://pbs.twimg.com/media/CvU4UZpXgAE1pAV.jpg,2.0,Chesapeake_Bay_retriever,0.8788219999999999,1800,6397
508,789530877013393408,2016-10-21 18:16:44+00:00,This is Rizzy. She smiles a lot. 12/10 contagious af https://t.co/TU4sZogVIq,"https://twitter.com/dog_rates/status/789530877013393408/photo/1,https://twitter.com/dog_rates/status/789530877013393408/photo/1,https://twitter.com/dog_rates/status/789530877013393408/photo/1",12.0,10.0,rizzy,Twitter for iPhone,,https://pbs.twimg.com/media/CvT6IV6WEAQhhV5.jpg,3.0,schipperke,0.363272,3169,11111
509,789314372632018944,2016-10-21 03:56:25+00:00,"HE WAS JUST A LIL SLEEPY FROM BEING SUCH A GOOD DOGGI ALL THE TIME MISTAKES HAPPEN 13/10
https://t.co/G2ms0A5jWM",https://twitter.com/sebscat/status/788818328538099712,13.0,10.0,none,Twitter for iPhone,,,,,,2144,8211
510,789268448748703744,2016-10-21 00:53:56+00:00,This is Stella. She's happier than I will ever be. 10/10 would trade lives with https://t.co/JSs2bfDtTS,https://twitter.com/dog_rates/status/789268448748703744/photo/1,10.0,10.0,stella,Twitter for iPhone,,https://pbs.twimg.com/media/CvQLdotWcAAZn86.jpg,1.0,malamute,0.81286,2454,8676
511,789137962068021249,2016-10-20 16:15:26+00:00,This is Bo. He's a West Congolese Bugaboop Snuggle. Rather exotic. Master of the head tilt. 12/10 would pay to pet https://t.co/2jwxxtNzoN,"https://twitter.com/dog_rates/status/789137962068021249/photo/1,https://twitter.com/dog_rates/status/789137962068021249/photo/1,https://twitter.com/dog_rates/status/789137962068021249/photo/1",12.0,10.0,bo,Twitter for iPhone,,https://pbs.twimg.com/media/CvOUw8vWYAAzJDq.jpg,2.0,Chihuahua,0.746135,2615,9245
512,788908386943430656,2016-10-20 01:03:11+00:00,"This is Lucy. She destroyed not one, but two remotes trying to turn off the debate. 11/10 relatable af https://t.co/3BXh073tDm",https://twitter.com/dog_rates/status/788908386943430656/photo/1,11.0,10.0,lucy,Twitter for iPhone,,https://pbs.twimg.com/media/CvLD-mbWYAAFI8w.jpg,1.0,golden_retriever,0.0340897,11743,26126
513,788765914992902144,2016-10-19 15:37:03+00:00,This is Butter. She can have whatever she wants forever. 12/10 would hug softly https://t.co/x5gXRS1abq,https://twitter.com/dog_rates/status/788765914992902144/photo/1,12.0,10.0,butter,Twitter for iPhone,,https://pbs.twimg.com/media/CvJCabcWgAIoUxW.jpg,1.0,cocker_spaniel,0.500509,9690,25968
514,788412144018661376,2016-10-18 16:11:17+00:00,This is Dexter. He breaks hearts for a living. 11/10 h*ckin handsome af https://t.co/4DhSsC1W7S,"https://twitter.com/dog_rates/status/788412144018661376/photo/1,https://twitter.com/dog_rates/status/788412144018661376/photo/1",11.0,10.0,dexter,Twitter for iPhone,,https://pbs.twimg.com/media/CvEAqQoWgAADj5K.jpg,1.0,golden_retriever,0.805238,4945,14754
515,788178268662984705,2016-10-18 00:41:57+00:00,Atlas is back and this time he's got doggles. Still 13/10 solarly conscious af https://t.co/s7MgFWDySc,"https://twitter.com/dog_rates/status/788178268662984705/photo/1,https://twitter.com/dog_rates/status/788178268662984705/photo/1,https://twitter.com/dog_rates/status/788178268662984705/photo/1,https://twitter.com/dog_rates/status/788178268662984705/photo/1",13.0,10.0,none,Twitter for iPhone,,https://pbs.twimg.com/media/CvAr88kW8AEKNAO.jpg,2.0,Samoyed,0.73548,1984,6910
516,788150585577050112,2016-10-17 22:51:57+00:00,This is Leo. He's a golden chow. Rather h*ckin rare. 13/10 would give extra pats https://t.co/xosHjFzVXc,"https://twitter.com/dog_rates/status/788150585577050112/photo/1,https://twitter.com/dog_rates/status/788150585577050112/photo/1,https://twitter.com/dog_rates/status/788150585577050112/photo/1,https://twitter.com/dog_rates/status/788150585577050112/photo/1",13.0,10.0,leo,Twitter for iPhone,,https://pbs.twimg.com/media/CvASw6dWcAQmo3X.jpg,3.0,chow,0.814145,1207,5810
517,788039637453406209,2016-10-17 15:31:05+00:00,Did... did they pick out that license plate? 12/10 for both https://t.co/lRmUUOxgbQ,"https://twitter.com/dog_rates/status/788039637453406209/photo/1,https://twitter.com/dog_rates/status/788039637453406209/photo/1",12.0,10.0,none,Twitter for iPhone,,,,,,1235,5807
518,787810552592695296,2016-10-17 00:20:47+00:00,This is Frank. He wears sunglasses and walks himself. 11/10 I'll never be this cool or independent https://t.co/pNNjBtHWPc,"https://twitter.com/dog_rates/status/787810552592695296/photo/1,https://twitter.com/dog_rates/status/787810552592695296/photo/1",11.0,10.0,frank,Twitter for iPhone,,https://pbs.twimg.com/media/Cu7dg2RXYAIaGXE.jpg,2.0,pug,0.362835,2849,8165
519,787717603741622272,2016-10-16 18:11:26+00:00,This is Tonks. She is a service puppo. Can hear a caterpillar hiccup from 7 miles away. 13/10 would follow anywhere https://t.co/i622ZbWkUp,"https://twitter.com/dog_rates/status/787717603741622272/photo/1,https://twitter.com/dog_rates/status/787717603741622272/photo/1,https://twitter.com/dog_rates/status/787717603741622272/photo/1,https://twitter.com/dog_rates/status/787717603741622272/photo/1",13.0,10.0,tonks,Twitter for iPhone,puppo,https://pbs.twimg.com/media/Cu6I9vvWIAAZG0a.jpg,3.0,German_shepherd,0.992339,2591,9724
520,787397959788929025,2016-10-15 21:01:17+00:00,This is Moose. He's rather h*ckin dangerous (you can tell by the collar). 11/10 would still attempt to snug https://t.co/lHVHGdDzb3,https://twitter.com/dog_rates/status/787397959788929025/photo/1,11.0,10.0,moose,Twitter for iPhone,,https://pbs.twimg.com/media/Cu1mQsDWEAAU_VQ.jpg,1.0,Chihuahua,0.900483,2674,10348
521,787322443945877504,2016-10-15 16:01:13+00:00,This is Lincoln. He forgot to use his blinker when he changed lanes just now. Guilty as h*ck. Still 10/10 https://t.co/lsrR83SiVp,https://twitter.com/dog_rates/status/787322443945877504/photo/1,10.0,10.0,lincoln,Twitter for iPhone,,https://pbs.twimg.com/media/Cu0hlfwWYAEdnXO.jpg,1.0,golden_retriever,0.1057029999999999,1632,7414
522,786963064373534720,2016-10-14 16:13:10+00:00,This is Rory. He's got an interview in a few minutes. Looking spiffy af. Nervous as h*ck tho. 12/10 would hire https://t.co/ibj5g6xaAj,https://twitter.com/dog_rates/status/786963064373534720/photo/1,12.0,10.0,rory,Twitter for iPhone,,https://pbs.twimg.com/media/Cuvau3MW8AAxaRv.jpg,1.0,golden_retriever,0.915303,7454,25325
523,786709082849828864,2016-10-13 23:23:56+00:00,"This is Logan, the Chow who lived. He solemnly swears he's up to lots of good. H*ckin magical af 9.75/10 https://t.co/yBO5wuqaPS",https://twitter.com/dog_rates/status/786709082849828864/photo/1,9.75,10.0,logan,Twitter for iPhone,,https://pbs.twimg.com/media/CurzvFTXgAA2_AP.jpg,1.0,Pomeranian,0.467321,5745,17387
524,786664955043049472,2016-10-13 20:28:35+00:00,"""Honestly Kathleen I just want more Ken Bone"" 12/10 https://t.co/HmlEvAMP4r",https://twitter.com/dog_rates/status/786664955043049472/photo/1,12.0,10.0,none,Twitter for iPhone,,https://pbs.twimg.com/media/CurLmoqXgAEPoJ-.jpg,1.0,Leonberg,0.512034,2371,10064
525,786595970293370880,2016-10-13 15:54:28+00:00,This is Dale. He's a real spookster. Did me quite the frighten. 11/10 not too spooky to pet tho https://t.co/L8BWDD4oBX,https://twitter.com/dog_rates/status/786595970293370880/photo/1,11.0,10.0,dale,Twitter for iPhone,,https://pbs.twimg.com/media/CuqM0fVWAAAboKR.jpg,1.0,Pembroke,0.709512,2930,8998
526,786363235746385920,2016-10-13 00:29:39+00:00,This is Rizzo. He has many talents. A true renaissance doggo. 13/10 entertaining af https://t.co/TVXpEJB7Wn,"https://twitter.com/dog_rates/status/786363235746385920/photo/1,https://twitter.com/dog_rates/status/786363235746385920/photo/1,https://twitter.com/dog_rates/status/786363235746385920/photo/1,https://twitter.com/dog_rates/status/786363235746385920/photo/1",13.0,10.0,rizzo,Twitter for iPhone,doggo,https://pbs.twimg.com/media/Cum5LlfWAAAyPcS.jpg,1.0,golden_retriever,0.929266,3228,10301
527,786286427768250368,2016-10-12 19:24:27+00:00,This is Arnie. He's afraid of his own bark. 12/10 would comfort https://t.co/ObT2tSxXit,https://vine.co/v/5XH0WqHwiFp,12.0,10.0,arnie,Vine - Make a Scene,,,,,,2657,7577
528,786233965241827333,2016-10-12 15:55:59+00:00,This is Mattie. She's extremely dangerous. Will bite your h*ckin finger right off. Still 11/10 would pet with caution https://t.co/78c9W8kLFh,https://twitter.com/dog_rates/status/786233965241827333/photo/1,11.0,10.0,mattie,Twitter for iPhone,,https://pbs.twimg.com/media/CulDnZpWcAAGbZ-.jpg,1.0,Labrador_retriever,0.478193,4401,14438
529,785927819176054784,2016-10-11 19:39:28+00:00,This is Lucy. She's strives to be the best potato she can be. 12/10 would boop https://t.co/lntsj7Fc4Y,https://twitter.com/dog_rates/status/785927819176054784/photo/1,12.0,10.0,lucy,Twitter for iPhone,,https://pbs.twimg.com/media/CugtKeXWEAAamDZ.jpg,1.0,toy_poodle,0.00849262,2996,10835
530,785872687017132033,2016-10-11 16:00:24+00:00,Meet Rusty. He appears to be rather h*ckin fluffy. Also downright adorable af. 12/10 would rub my face against his https://t.co/1j9kLGb4wV,https://twitter.com/dog_rates/status/785872687017132033/video/1,12.0,10.0,rusty,Twitter for iPhone,,https://pbs.twimg.com/ext_tw_video_thumb/785872596088811520/pu/img/5O-_BgqdFQu_2Bt7.jpg,1.0,Great_Pyrenees,0.392108,1675,6357
531,785639753186217984,2016-10-11 00:34:48+00:00,This is Pinot. He's a sophisticated doggo. You can tell by the hat. Also pointier than your average pupper. Still 10/10 would pet cautiously https://t.co/f2wmLZTPHd,"https://twitter.com/dog_rates/status/785639753186217984/photo/1,https://twitter.com/dog_rates/status/785639753186217984/photo/1",10.0,10.0,pinot,Twitter for iPhone,"doggo, pupper",,,,,2107,7467
532,785533386513321988,2016-10-10 17:32:08+00:00,This is Dallas. Her tongue is ridiculous. 11/10 h*ckin proud af https://t.co/h4jhlH4EyG,"https://twitter.com/dog_rates/status/785533386513321988/photo/1,https://twitter.com/dog_rates/status/785533386513321988/photo/1",11.0,10.0,dallas,Twitter for iPhone,,https://pbs.twimg.com/media/CubGchjXEAA6gpw.jpg,2.0,miniature_pinscher,0.4360229999999999,1845,8607
533,785515384317313025,2016-10-10 16:20:36+00:00,"Today, 10/10, should be National Dog Rates Day",,10.0,10.0,none,Twitter for iPhone,,,,,,1168,5808
534,785264754247995392,2016-10-09 23:44:41+00:00,This is Doc. He requested to be carried around like that. 12/10 anything for Doc https://t.co/mWYACm4qnx,https://twitter.com/dog_rates/status/785264754247995392/photo/1,12.0,10.0,doc,Twitter for iPhone,,https://pbs.twimg.com/media/CuXSHNnWcAIWEwn.jpg,1.0,chow,0.056137,1524,6912
535,785170936622350336,2016-10-09 17:31:53+00:00,This is Hero. He was enjoying the car ride until he remembered that bees are dying globally at an alarming rate. 11/10 https://t.co/cubFg7F4qQ,"https://twitter.com/dog_rates/status/785170936622350336/photo/1,https://twitter.com/dog_rates/status/785170936622350336/photo/1,https://twitter.com/dog_rates/status/785170936622350336/photo/1,https://twitter.com/dog_rates/status/785170936622350336/photo/1",11.0,10.0,hero,Twitter for iPhone,,https://pbs.twimg.com/media/CuV8yfxXEAAUlye.jpg,2.0,Eskimo_dog,0.0274944,4512,11400
536,784826020293709826,2016-10-08 18:41:19+00:00,This is Rusty. He's going D1 for sure. Insane vertical. 13/10 would draft https://t.co/AsykOwMrXQ,https://twitter.com/dog_rates/status/784826020293709826/photo/1,13.0,10.0,rusty,Twitter for iPhone,,https://pbs.twimg.com/media/CuRDF-XWcAIZSer.jpg,1.0,chow,0.0903414,3018,9594
537,784517518371221505,2016-10-07 22:15:26+00:00,This is Frankie. He has yet to learn how to control his tongue. 11/10 maybe one day https://t.co/p6fgYe2dB6,"https://twitter.com/dog_rates/status/784517518371221505/photo/1,https://twitter.com/dog_rates/status/784517518371221505/photo/1,https://twitter.com/dog_rates/status/784517518371221505/photo/1",11.0,10.0,frankie,Twitter for iPhone,,https://pbs.twimg.com/media/CuMqhGrXYAQwRqU.jpg,2.0,malamute,0.757764,2371,8514
538,784431430411685888,2016-10-07 16:33:21+00:00,This is Stormy. He's curly af. Already pupared for Coachella next year. 12/10 https://t.co/PHA1vtqqpt,https://twitter.com/dog_rates/status/784431430411685888/photo/1,12.0,10.0,stormy,Twitter for iPhone,,https://pbs.twimg.com/media/CuLcNkCXgAEIwK2.jpg,1.0,miniature_poodle,0.744819,1185,5448
539,784183165795655680,2016-10-07 00:06:50+00:00,This is Reginald. He's one magical puppo. Aerodynamic af. 12/10 would catch https://t.co/t0cEeRbcXJ,https://vine.co/v/5ghHLBMMdlV,12.0,10.0,reginald,Vine - Make a Scene,puppo,,,,,7501,18999
540,784057939640352768,2016-10-06 15:49:14+00:00,This is Balto. He's very content. Legendary tongue slippage. 12/10 would pet forever https://t.co/T7Jr4Gw4sC,https://vine.co/v/5gKxeUpuKEr,12.0,10.0,balto,Vine - Make a Scene,,,,,,10383,28167
541,783839966405230592,2016-10-06 01:23:05+00:00,This is Riley. His owner put a donut pillow around him and he loves it so much he won't let anyone take it off. 13/10 https://t.co/8TCQcsZCZ8,"https://twitter.com/dog_rates/status/783839966405230592/photo/1,https://twitter.com/dog_rates/status/783839966405230592/photo/1,https://twitter.com/dog_rates/status/783839966405230592/photo/1",13.0,10.0,riley,Twitter for iPhone,,,,,,10075,28444
542,783821107061198850,2016-10-06 00:08:09+00:00,This is Mairi. She has mastered the art of camouflage. 12/10 h*ckin sneaky af https://t.co/STcPjiNAHp,"https://twitter.com/dog_rates/status/783821107061198850/photo/1,https://twitter.com/dog_rates/status/783821107061198850/photo/1",12.0,10.0,mairi,Twitter for iPhone,,https://pbs.twimg.com/media/CuCxIzyWEAQTnQA.jpg,1.0,Lakeland_terrier,0.265659,1832,6998
543,783695101801398276,2016-10-05 15:47:27+00:00,This is Loomis. He's the leader of the Kenneth search party. The passion is almost overwhelming. 12/10 one day he will be free https://t.co/kCRKlFg4AY,"https://twitter.com/dog_rates/status/783695101801398276/photo/1,https://twitter.com/dog_rates/status/783695101801398276/photo/1,https://twitter.com/dog_rates/status/783695101801398276/photo/1",12.0,10.0,loomis,Twitter for iPhone,,https://pbs.twimg.com/media/CuA-iRHXYAAWP8e.jpg,3.0,chow,0.314265,3000,9889
544,783466772167098368,2016-10-05 00:40:09+00:00,This is Finn. He likes eavesdropping from filing cabinets. It's a real issue but no one has approached him about it. 11/10 would still pet https://t.co/s8W8Del9HQ,"https://twitter.com/dog_rates/status/783466772167098368/photo/1,https://twitter.com/dog_rates/status/783466772167098368/photo/1",11.0,10.0,finn,Twitter for iPhone,,https://pbs.twimg.com/media/Ct9u3ljW8AEnVIm.jpg,1.0,Chihuahua,0.789,2080,7992
545,783391753726550016,2016-10-04 19:42:03+00:00,Meet Godi. He's an avid beachgoer and part time rainbow summoner. Eyeliner flawless af. 13/10 would snug well https://t.co/BO936YdJdi,"https://twitter.com/dog_rates/status/783391753726550016/photo/1,https://twitter.com/dog_rates/status/783391753726550016/photo/1,https://twitter.com/dog_rates/status/783391753726550016/photo/1,https://twitter.com/dog_rates/status/783391753726550016/photo/1",13.0,10.0,godi,Twitter for iPhone,,https://pbs.twimg.com/media/Ct8qn8EWIAAk9zP.jpg,4.0,Norwegian_elkhound,0.87713,5104,16023
546,783334639985389568,2016-10-04 15:55:06+00:00,This is Dave. He's currently in a predicament. Doesn't seem to mind tho. 12/10 someone assist Dave https://t.co/nfprKAXqwu,"https://twitter.com/dog_rates/status/783334639985389568/photo/1,https://twitter.com/dog_rates/status/783334639985389568/photo/1,https://twitter.com/dog_rates/status/783334639985389568/photo/1",12.0,10.0,dave,Twitter for iPhone,,https://pbs.twimg.com/media/Ct72q9jWcAAhlnw.jpg,2.0,Cardigan,0.593858,10909,27554
547,783085703974514689,2016-10-03 23:25:55+00:00,This is Earl. He can't catch. Did his best tho. 11/10 would repair confidence with extra pats https://t.co/IsqyvbjFgM,"https://twitter.com/dog_rates/status/783085703974514689/photo/1,https://twitter.com/dog_rates/status/783085703974514689/photo/1",11.0,10.0,earl,Twitter for iPhone,,https://pbs.twimg.com/media/Ct4URfWUAAQ7lKe.jpg,1.0,Chesapeake_Bay_retriever,0.240602,2025,7744
548,782969140009107456,2016-10-03 15:42:44+00:00,This is Cali. She arrived preassembled. Convenient af. 12/10 appears to be rather h*ckin pettable https://t.co/vOBV1ZqVcX,"https://twitter.com/dog_rates/status/782969140009107456/photo/1,https://twitter.com/dog_rates/status/782969140009107456/photo/1",12.0,10.0,cali,Twitter for iPhone,,https://pbs.twimg.com/media/Ct2qO5PXEAE6eB0.jpg,1.0,golden_retriever,0.171393,6912,22857
549,782747134529531904,2016-10-03 01:00:34+00:00,This is Deacon. He's the happiest almost dry doggo I've ever seen. 11/10 would smile back https://t.co/C6fUMnHt1H,https://twitter.com/dog_rates/status/782747134529531904/photo/1,11.0,10.0,deacon,Twitter for iPhone,doggo,https://pbs.twimg.com/media/CtzgXgeXYAA1Gxw.jpg,1.0,golden_retriever,0.560699,1323,7081
550,782722598790725632,2016-10-02 23:23:04+00:00,"This is Penny. She fought a bee and the bee won. 10/10 you're fine Penny, everything's fine https://t.co/zrMVdfFej6",https://twitter.com/dog_rates/status/782722598790725632/photo/1,10.0,10.0,penny,Twitter for iPhone,,https://pbs.twimg.com/media/CtzKC7zXEAALfSo.jpg,1.0,Irish_setter,0.574557,5029,16331
551,782598640137187329,2016-10-02 15:10:30+00:00,This is Timmy. He's quite large. According to a trusted source it's actually a dog wearing a dog suit. 11/10 https://t.co/BIUchFwHqn,https://twitter.com/dog_rates/status/782598640137187329/photo/1,11.0,10.0,timmy,Twitter for iPhone,,https://pbs.twimg.com/media/CtxZTtxUMAEduGo.jpg,1.0,malamute,0.8408709999999999,1770,7392
552,782305867769217024,2016-10-01 19:47:08+00:00,This is Sampson. He just graduated. Ready to be a doggo now. Time for the real world. 12/10 have fun with taxes https://t.co/pgVKxRw0s1,"https://twitter.com/dog_rates/status/782305867769217024/photo/1,https://twitter.com/dog_rates/status/782305867769217024/photo/1,https://twitter.com/dog_rates/status/782305867769217024/photo/1",12.0,10.0,sampson,Twitter for iPhone,doggo,https://pbs.twimg.com/media/CttPBt0WIAAcsDE.jpg,1.0,briard,0.5044270000000001,5138,15746
553,781955203444699136,2016-09-30 20:33:43+00:00,This is Chipson. He weighed in at .3 ounces and is officially super h*ckin smol. Space-saving af. 11/10 would snug delicately https://t.co/FjEsk7A1JV,https://twitter.com/dog_rates/status/781955203444699136/photo/1,11.0,10.0,chipson,Twitter for iPhone,,,,,,3147,10583
554,781661882474196992,2016-09-30 01:08:10+00:00,Who keeps sending in pictures without dogs in them? This needs to stop. 5/10 for the mediocre road https://t.co/ELqelxWMrC,https://twitter.com/dog_rates/status/781661882474196992/photo/1,5.0,10.0,none,Twitter for iPhone,,https://pbs.twimg.com/media/CtkFS72WcAAiUrs.jpg,1.0,Pembroke,0.438087,2529,9892
555,781655249211752448,2016-09-30 00:41:48+00:00,This is Combo. The daily struggles of being a doggo have finally caught up with him. 11/10 https://t.co/LOKrNo0OM7,https://vine.co/v/5rt6T3qm7hL,11.0,10.0,combo,Vine - Make a Scene,doggo,,,,,1057,3792
556,781524693396357120,2016-09-29 16:03:01+00:00,Idk why this keeps happening. We only rate dogs. Not Bangladeshi Couch Chipmunks. Please only send dogs... 12/10 https://t.co/ya7bviQUUf,https://twitter.com/dog_rates/status/781524693396357120/photo/1,12.0,10.0,none,Twitter for iPhone,,https://pbs.twimg.com/media/CtiIj0AWcAEBDvw.jpg,1.0,Chesapeake_Bay_retriever,0.0035225,5155,19626
557,781308096455073793,2016-09-29 01:42:20+00:00,"Pupper butt 1, Doggo 0. Both 12/10 https://t.co/WQvcPEpH2u",https://vine.co/v/5rgu2Law2ut,12.0,10.0,none,Vine - Make a Scene,"doggo, pupper",,,,,2391,6760
558,781251288990355457,2016-09-28 21:56:36+00:00,This is Oakley. He just got yelled at for going 46 in a 45. Churlish af. 11/10 would still pet so well https://t.co/xIYsa6LPA4,"https://twitter.com/dog_rates/status/781251288990355457/photo/1,https://twitter.com/dog_rates/status/781251288990355457/photo/1",11.0,10.0,oakley,Twitter for iPhone,,https://pbs.twimg.com/media/CteP5H5WcAEhdLO.jpg,2.0,Mexican_hairless,0.8877709999999999,1934,7936
559,781163403222056960,2016-09-28 16:07:23+00:00,"We normally don't rate lobsters, but this one appears to be a really good lobster. 10/10 would pet with caution https://t.co/YkHc7U7uUy",https://twitter.com/dog_rates/status/781163403222056960/photo/1,10.0,10.0,none,Twitter for iPhone,,https://pbs.twimg.com/media/Ctc_-BTWEAAQpZh.jpg,1.0,Shetland_sheepdog,0.973841,2585,9300
560,780931614150983680,2016-09-28 00:46:20+00:00,I want to finally rate this iconic puppo who thinks the parade is all for him. 13/10 would absolutely attend https://t.co/5dUYOu4b8d,https://twitter.com/dog_rates/status/780931614150983680/photo/1,13.0,10.0,none,Twitter for iPhone,puppo,,,,,6762,20517
561,780858289093574656,2016-09-27 19:54:58+00:00,"This is Dash. He's very stylish, but also incredibly unimpressed with the current state of our nation. 10/10 would pet ears first https://t.co/YElO4hvXI6",https://twitter.com/dog_rates/status/780858289093574656/photo/1,10.0,10.0,dash,Twitter for iPhone,,https://pbs.twimg.com/media/CtYqeNHWgAATqYZ.jpg,1.0,Chesapeake_Bay_retriever,0.488555,1871,6820
562,780800785462489090,2016-09-27 16:06:28+00:00,This is Koda. He has a weird relationship with tall grass. Slightly concerning. 11/10 would def still pet https://t.co/KQzSR8eCsw,"https://twitter.com/dog_rates/status/780800785462489090/photo/1,https://twitter.com/dog_rates/status/780800785462489090/photo/1,https://twitter.com/dog_rates/status/780800785462489090/photo/1",11.0,10.0,koda,Twitter for iPhone,,https://pbs.twimg.com/media/CtX2Kr9XYAAuxrM.jpg,2.0,Siberian_husky,0.951963,1203,5202
563,780601303617732608,2016-09-27 02:53:48+00:00,Meet Hercules. He can have whatever he wants for the rest of eternity. 12/10 would snug passionately https://t.co/mH0IOyFdIG,https://twitter.com/dog_rates/status/780601303617732608/photo/1,12.0,10.0,hercules,Twitter for iPhone,,https://pbs.twimg.com/media/CtVAvX-WIAAcGTf.jpg,1.0,Saint_Bernard,0.995143,3129,11449
564,780543529827336192,2016-09-26 23:04:13+00:00,Here's a perturbed super floof. 12/10 would snug so damn well https://t.co/VG095mi09Q,https://twitter.com/dog_rates/status/780543529827336192/photo/1,12.0,10.0,none,Twitter for iPhone,,https://pbs.twimg.com/media/CtUMLzRXgAAbZK5.jpg,1.0,golden_retriever,0.628312,1629,5960
565,780459368902959104,2016-09-26 17:29:48+00:00,"This is Bear. Don't worry, he's not a real bear tho. Contains unreal amounts of squish. 11/10 heteroskedastic af https://t.co/coi4l1T2Sm",https://twitter.com/dog_rates/status/780459368902959104/photo/1,11.0,10.0,bear,Twitter for iPhone,,https://pbs.twimg.com/media/CtS_p9kXEAE2nh8.jpg,1.0,Great_Dane,0.3824909999999999,1005,5005
