,tweet_id,timestamp,text,expanded_urls,rating_numerator,rating_denominator,name,tweet_source,dog_stage,jpg_url,img_num,dog_breed,p_conf,retweet_count,favorite_count
1482,679862121895714818,2015-12-24 03:12:15+00:00,"""Dammit hooman I'm jus trynna lik the fler"" 11/10 https://t.co/eRZRI8OTj7",https://twitter.com/dog_rates/status/679862121895714818/photo/1,11.0,10.0,none,Twitter for iPhone,,https://pbs.twimg.com/media/CW9a_h1WwAApmAy.jpg,1.0,EntleBucher,0.5232060000000001,558,2260
1483,679854723806179328,2015-12-24 02:42:51+00:00,This is Bruce. He's a rare pup. Covered in Frosted Flakes. Nifty gold teeth. Overall good dog. 7/10 would pet firmly https://t.co/RtxxACzZ8A,https://twitter.com/dog_rates/status/679854723806179328/photo/1,7.0,10.0,bruce,Twitter for iPhone,,https://pbs.twimg.com/media/CW9UQ7oWkAAErmU.jpg,1.0,chow,0.00230739,1105,2619
1484,679844490799091713,2015-12-24 02:02:12+00:00,This is Willie. He's floating away and needs your assistance. Please someone help Willie. 10/10 https://t.co/MJqygWqt8X,https://twitter.com/dog_rates/status/679844490799091713/photo/1,10.0,10.0,willie,Twitter for iPhone,,https://pbs.twimg.com/media/CW9K9VeVAAE0j-x.jpg,1.0,Airedale,0.903832,689,2192
1485,679828447187857408,2015-12-24 00:58:27+00:00,Everybody look at this beautiful pupper 13/10 https://t.co/hyAC5Hq9GC,"https://twitter.com/dog_rates/status/679828447187857408/photo/1,https://twitter.com/dog_rates/status/679828447187857408/photo/1,https://twitter.com/dog_rates/status/679828447187857408/photo/1",13.0,10.0,none,Twitter for iPhone,pupper,https://pbs.twimg.com/media/CW88XN4WsAAlo8r.jpg,3.0,Chihuahua,0.346545,12637,33263
1486,679777920601223168,2015-12-23 21:37:40+00:00,This is Rinna. She's melting. 10/10 get inside pupper https://t.co/PA0czwucsb,https://twitter.com/dog_rates/status/679777920601223168/photo/1,10.0,10.0,rinna,Twitter for iPhone,pupper,https://pbs.twimg.com/media/CW8OYajUMAAPRoF.jpg,1.0,bloodhound,0.5288189999999999,1000,2862
1487,679736210798047232,2015-12-23 18:51:56+00:00,This pup's name is Sabertooth (parents must be cool). Ears for days. Jumps unannounced. 9/10 would pet diligently https://t.co/iazoiNUviP,https://twitter.com/dog_rates/status/679736210798047232/photo/1,9.0,10.0,none,Twitter for iPhone,,https://pbs.twimg.com/media/CW7oelWWcAAhyzz.jpg,1.0,French_bulldog,0.319139,721,1918
1488,679729593985699840,2015-12-23 18:25:38+00:00,This is Hunter. He was playing with his ball minding his own business. Has no idea what happened to the carpet. 8/10 https://t.co/DbUTDI3u1R,https://twitter.com/dog_rates/status/679729593985699840/photo/1,8.0,10.0,hunter,Twitter for iPhone,,https://pbs.twimg.com/media/CW7iddWUsAElUC0.jpg,1.0,West_Highland_white_terrier,0.0935148,751,1996
1489,679722016581222400,2015-12-23 17:55:32+00:00,This is Mike. He is a Jordanian Frito Pilates. Frowning because he can't see directly in front of him. 8/10 https://t.co/NL5QJwdEpF,https://twitter.com/dog_rates/status/679722016581222400/photo/1,8.0,10.0,mike,Twitter for iPhone,,https://pbs.twimg.com/media/CW7bkW6WQAAksgB.jpg,1.0,boxer,0.459604,426,1545
1490,679530280114372609,2015-12-23 05:13:38+00:00,Guys this really needs to stop. We've been over this way too many times. This is a giraffe. We only rate dogs.. 7/10 https://t.co/yavgkHYPOC,https://twitter.com/dog_rates/status/679530280114372609/photo/1,7.0,10.0,a,Twitter for iPhone,,https://pbs.twimg.com/media/CW4tL1vWcAIw1dw.jpg,1.0,dalmatian,0.750256,1889,4381
1491,679527802031484928,2015-12-23 05:03:47+00:00,This little pupper just arrived. 11/10 would snug https://t.co/DA5aqnSGfB,https://twitter.com/dog_rates/status/679527802031484928/photo/1,11.0,10.0,none,Twitter for iPhone,pupper,,,,,653,2436
1492,679511351870550016,2015-12-23 03:58:25+00:00,Say hello to William. He makes fun of others because he's terrified of his own deep-seated insecurities. 7/10 https://t.co/bwuV6FlRxr,https://twitter.com/dog_rates/status/679511351870550016/photo/1,7.0,10.0,william,Twitter for iPhone,,https://pbs.twimg.com/media/CW4b-GUWYAAa8QO.jpg,1.0,Chihuahua,0.761972,1152,3080
1493,679503373272485890,2015-12-23 03:26:43+00:00,This is Dwight. He's a pointy pupper. Very docile. Attracts marshmallows. Hurts to pet but definitely worth it 8/10 https://t.co/jjW7zTxY9Z,https://twitter.com/dog_rates/status/679503373272485890/photo/1,8.0,10.0,dwight,Twitter for iPhone,pupper,,,,,1341,2925
1494,679475951516934144,2015-12-23 01:37:45+00:00,This is Evy. She doesn't want to be a Koala. 9/10 https://t.co/VITeF0Kl9L,https://twitter.com/dog_rates/status/679475951516934144/photo/1,9.0,10.0,evy,Twitter for iPhone,,https://pbs.twimg.com/media/CW37xZbUoAAUXe5.jpg,1.0,Maltese_dog,0.145742,587,1929
1495,679462823135686656,2015-12-23 00:45:35+00:00,Meet Hurley. He's the curly one. He hugs every other dog he sees during his walk. 11/10 for spreading the love https://t.co/M6vqkt2GKV,https://twitter.com/dog_rates/status/679462823135686656/photo/1,11.0,10.0,hurley,Twitter for iPhone,,https://pbs.twimg.com/media/CW3v1KxW8AAIOuy.jpg,1.0,toy_poodle,0.62178,17064,29486
1496,679405845277462528,2015-12-22 20:59:10+00:00,Crazy unseen footage from Jurassic Park. 10/10 for both dinosaur puppers https://t.co/L8wt2IpwxO,https://vine.co/v/iKVFEigMLxP,10.0,10.0,none,Vine - Make a Scene,,,,,,1078,2174
1497,679158373988876288,2015-12-22 04:35:49+00:00,This is Rubio. He has too much skin. 11/10 https://t.co/NLOHmlENag,https://twitter.com/dog_rates/status/679158373988876288/photo/1,11.0,10.0,rubio,Twitter for iPhone,,https://pbs.twimg.com/media/CWza7kpWcAAdYLc.jpg,1.0,pug,0.272205,7266,19486
1498,679148763231985668,2015-12-22 03:57:37+00:00,I know everyone's excited for Christmas but that doesn't mean you can send in reindeer. We only rate dogs... 8/10 https://t.co/eWjWgbOCYL,https://twitter.com/dog_rates/status/679148763231985668/photo/1,8.0,10.0,none,Twitter for iPhone,,https://pbs.twimg.com/media/CWzSMmAWsAAyB1u.jpg,1.0,Italian_greyhound,0.302685,930,2560
1499,679132435750195208,2015-12-22 02:52:45+00:00,This is Louis. He's a river dancer. His friends think it's badass. All are very supportive. 10/10 for Louis https://t.co/qoIvjKMY58,https://twitter.com/dog_rates/status/679132435750195208/photo/1,10.0,10.0,louis,Twitter for iPhone,,https://pbs.twimg.com/media/CWzDWOkXAAAP0k7.jpg,1.0,Scottish_deerhound,0.1946099999999999,1039,2715
1500,679111216690831360,2015-12-22 01:28:25+00:00,This is officially the greatest yawn of all time. 12/10 https://t.co/4R0Cc0sLVE,https://twitter.com/dog_rates/status/679111216690831360/video/1,12.0,10.0,officially,Twitter for iPhone,,https://pbs.twimg.com/ext_tw_video_thumb/679111114081370114/pu/img/hFca8BHjRopgD0cM.jpg,1.0,kelpie,0.189423,2318,5447
1501,679062614270468097,2015-12-21 22:15:18+00:00,This is Chompsky. He lives up to his name. 11/10 https://t.co/Xl37lQEWd0,"https://twitter.com/dog_rates/status/679062614270468097/photo/1,https://twitter.com/dog_rates/status/679062614270468097/photo/1",11.0,10.0,chompsky,Twitter for iPhone,,https://pbs.twimg.com/media/CWyD2HGUYAQ1Xa7.jpg,2.0,schipperke,0.0455186,7226,15526
1502,679047485189439488,2015-12-21 21:15:11+00:00,This dog doesn't know how to stairs. Quite tragic really. 9/10 get it together pup https://t.co/kTpr9PTMg1,https://twitter.com/dog_rates/status/679047485189439488/photo/1,9.0,10.0,none,Twitter for iPhone,,https://pbs.twimg.com/media/CWx2FaLWcAEQ3vh.jpg,1.0,golden_retriever,0.00293035,588,2059
1503,679001094530465792,2015-12-21 18:10:50+00:00,This is Rascal. He's paddling an imaginary canoe. 11/10 https://t.co/Ajquq6oGSg,https://vine.co/v/iKIwAzEatd6,11.0,10.0,rascal,Vine - Make a Scene,,,,,,1099,2604
1504,678991772295516161,2015-12-21 17:33:48+00:00,If your Monday isn't going so well just take a look at this. Both 12/10 https://t.co/GJT6SILPGU,https://twitter.com/dog_rates/status/678991772295516161/photo/1,12.0,10.0,none,Twitter for iPhone,,https://pbs.twimg.com/media/CWxDaXHWsAAWV8W.jpg,1.0,Eskimo_dog,0.330216,1020,2078
1505,678969228704284672,2015-12-21 16:04:13+00:00,Meet Lola. She's a Metamorphic Chartreuse. Plays with her food. Insubordinate and churlish. Exquisite hardwood 11/10 https://t.co/etpBNXwN7f,https://twitter.com/dog_rates/status/678969228704284672/photo/1,11.0,10.0,lola,Twitter for iPhone,,https://pbs.twimg.com/media/CWwu6OLUkAEo3gq.jpg,1.0,Labrador_retriever,0.680251,412,1497
1506,678800283649069056,2015-12-21 04:52:53+00:00,Here's a pupper with some mean tan lines. Snazzy sweater though 12/10 https://t.co/DpCSVsl6vu,https://twitter.com/dog_rates/status/678800283649069056/photo/1,12.0,10.0,none,Twitter for iPhone,pupper,https://pbs.twimg.com/media/CWuVQSLW4AAI3w9.jpg,1.0,Labrador_retriever,0.213673,822,2360
1507,678798276842360832,2015-12-21 04:44:55+00:00,This is Linda. She fucking hates trees. 7/10 https://t.co/blaY85FIxR,https://twitter.com/dog_rates/status/678798276842360832/photo/1,7.0,10.0,linda,Twitter for iPhone,,https://pbs.twimg.com/media/CWuTbAKUsAAvZHh.jpg,1.0,Airedale,0.583122,1032,3171
1508,678774928607469569,2015-12-21 03:12:08+00:00,This is Tug. He's not required to wear the cone he just wants his voice to project more clearly. 11/10 https://t.co/Sp739Ou2qx,https://twitter.com/dog_rates/status/678774928607469569/photo/1,11.0,10.0,tug,Twitter for iPhone,,https://pbs.twimg.com/media/CWt-MNIWEAAUC9S.jpg,1.0,Pembroke,0.194681,822,2575
1509,678767140346941444,2015-12-21 02:41:11+00:00,This is Mia. She makes awful decisions. 8/10 https://t.co/G6TQVgTcZz,https://twitter.com/dog_rates/status/678767140346941444/photo/1,8.0,10.0,mia,Twitter for iPhone,,,,,,1236,3231
1510,678764513869611008,2015-12-21 02:30:45+00:00,"Meet Wilson. He got caught humping the futon. He's like ""dude, help me out here"" 10/10 I'd help Wilson out https://t.co/m6XoclB0qv",https://twitter.com/dog_rates/status/678764513869611008/photo/1,10.0,10.0,wilson,Twitter for iPhone,,https://pbs.twimg.com/media/CWt0ubZWcAAkFER.jpg,1.0,Irish_terrier,0.696646,419,1484
1511,678755239630127104,2015-12-21 01:53:54+00:00,This is Dash. He didn't think the water would be that cold. Damn it Dash it's December. Think a little. 10/10 https://t.co/NqcOwG8pxW,https://twitter.com/dog_rates/status/678755239630127104/photo/1,10.0,10.0,dash,Twitter for iPhone,,https://pbs.twimg.com/media/CWtsSQAUkAAnWws.jpg,1.0,malamute,0.606654,2943,6502
1512,678740035362037760,2015-12-21 00:53:29+00:00,Meet Tango. He's a large dog. Doesn't care much for personal space. Owner isn't very accepting. Tongue slip. 6/10 https://t.co/p2T5kGebxe,https://twitter.com/dog_rates/status/678740035362037760/photo/1,6.0,10.0,tango,Twitter for iPhone,,https://pbs.twimg.com/media/CWtede2WIAAF_AJ.jpg,1.0,beagle,0.0225251,1494,3407
1513,678708137298427904,2015-12-20 22:46:44+00:00,Here we are witnessing a wild field pupper. Lost his wallet in there. Rather unfortunate. 10/10 good luck pup https://t.co/sZy9Co74Bw,https://vine.co/v/eQjxxYaQ60K,10.0,10.0,none,Vine - Make a Scene,pupper,,,,,2197,5146
1514,678675843183484930,2015-12-20 20:38:24+00:00,Exotic pup here. Tail long af. Throat looks swollen. Might breathe fire. Exceptionally unfluffy 2/10 would still pet https://t.co/a8SqCaSo2r,https://twitter.com/dog_rates/status/678675843183484930/photo/1,2.0,10.0,none,Twitter for iPhone,,,,,,1324,2612
1515,678643457146150913,2015-12-20 18:29:43+00:00,Meet Grizz. He just arrived. Couldn't wait until Christmas. Worried bc he saw the swastikas on the carpet. 10/10 https://t.co/QBGwYrT7rv,https://twitter.com/dog_rates/status/678643457146150913/photo/1,10.0,10.0,grizz,Twitter for iPhone,,https://pbs.twimg.com/media/CWsGnyMVEAAM1Y1.jpg,1.0,Labrador_retriever,0.338757,361,1881
1516,678446151570427904,2015-12-20 05:25:42+00:00,Touching scene here. Really stirs up the emotions. The bond between father &amp; son. So beautiful. 10/10 for both pups https://t.co/AJWJHov5gx,https://twitter.com/dog_rates/status/678446151570427904/photo/1,10.0,10.0,none,Twitter for iPhone,,https://pbs.twimg.com/media/CWpTLOYWsAEDhcU.jpg,1.0,Staffordshire_bullterrier,0.284492,1375,3661
1517,678424312106393600,2015-12-20 03:58:55+00:00,This is Crystal. She's a shitty fireman. No sense of urgency. People could be dying Crystal. 2/10 just irresponsible https://t.co/rtMtjSl9pz,https://twitter.com/dog_rates/status/678424312106393600/photo/1,2.0,10.0,crystal,Twitter for iPhone,,https://pbs.twimg.com/media/CWo_T8gW4AAgJNo.jpg,1.0,Maltese_dog,0.759945,2291,5008
1518,678410210315247616,2015-12-20 03:02:53+00:00,Say hello to Jerome. He can shoot french fries out of his mouth at insane speeds. Deadly af. 10/10 https://t.co/dIy88HwrX8,https://twitter.com/dog_rates/status/678410210315247616/photo/1,10.0,10.0,jerome,Twitter for iPhone,,https://pbs.twimg.com/media/CWoyfMiWUAAmGdd.jpg,1.0,schipperke,0.145877,1616,3835
1519,678399652199309312,2015-12-20 02:20:55+00:00,This made my day. 12/10 please enjoy https://t.co/VRTbo3aAcm,https://twitter.com/dog_rates/status/678399652199309312/video/1,12.0,10.0,none,Twitter for iPhone,,https://pbs.twimg.com/ext_tw_video_thumb/678399528077250560/pu/img/BOjUNHRsYLeSo0hl.jpg,1.0,Bedlington_terrier,0.0150472,28666,73633
1520,678396796259975168,2015-12-20 02:09:34+00:00,These little fellas have opposite facial expressions. Both 12/10 https://t.co/LmThv0GWen,"https://twitter.com/dog_rates/status/678396796259975168/photo/1,https://twitter.com/dog_rates/status/678396796259975168/photo/1",12.0,10.0,none,Twitter for iPhone,,https://pbs.twimg.com/media/CWomSU_XIAAUYiK.jpg,2.0,Pembroke,0.95618,376,1460
1521,678389028614488064,2015-12-20 01:38:42+00:00,"This is Bella. She just learned that her final grade in chem was a 92.49 
poor pupper 11/10 https://t.co/auOoKuoveM",https://twitter.com/dog_rates/status/678389028614488064/photo/1,11.0,10.0,bella,Twitter for iPhone,pupper,https://pbs.twimg.com/media/CWofOHUWUAACGVa.jpg,1.0,miniature_pinscher,0.516284,383,1713
1522,678380236862578688,2015-12-20 01:03:46+00:00,This is Crumpet. He underestimated the snow. Quickly retreating. 10/10 https://t.co/a0Zx5LDFZa,https://twitter.com/dog_rates/status/678380236862578688/photo/1,10.0,10.0,crumpet,Twitter for iPhone,,https://pbs.twimg.com/media/CWoXOfSUAAA4u8g.jpg,1.0,Samoyed,0.0476014,824,2249
1523,678341075375947776,2015-12-19 22:28:09+00:00,This pupper likes tape. 12/10 https://t.co/cSp6w5GWgm,https://twitter.com/dog_rates/status/678341075375947776/photo/1,12.0,10.0,none,Twitter for iPhone,pupper,https://pbs.twimg.com/media/CWnznDTU4AAa-6P.jpg,1.0,golden_retriever,0.853284,474,1576
1524,678334497360859136,2015-12-19 22:02:01+00:00,This is Rosie. She has a snazzy bow tie and a fin for a tail. Probably super fast underwater. Cool socks 10/10 https://t.co/GO76MdGBs0,https://twitter.com/dog_rates/status/678334497360859136/photo/1,10.0,10.0,rosie,Twitter for iPhone,,https://pbs.twimg.com/media/CWntoDVWcAEl3NB.jpg,1.0,Norfolk_terrier,0.378643,226,1183
1525,678278586130948096,2015-12-19 18:19:51+00:00,Another spooky pupper here. Most definitely floating. No legs. Probably knows some dark magic. 10/10 very spooked https://t.co/JK8MByRzgj,https://twitter.com/dog_rates/status/678278586130948096/photo/1,10.0,10.0,none,Twitter for iPhone,pupper,https://pbs.twimg.com/media/CWm6xySUEAAqfFU.jpg,1.0,Maltese_dog,0.897841,5506,10441
1526,678255464182861824,2015-12-19 16:47:58+00:00,This is Jessifer. She is a Bismoth Teriyaki. Flowers being attacked by hurricanes on bandana (rad). 9/10 stellar pup https://t.co/nZhmRwZzWv,https://twitter.com/dog_rates/status/678255464182861824/photo/1,9.0,10.0,jessifer,Twitter for iPhone,,https://pbs.twimg.com/media/CWmlvxJU4AEAqaN.jpg,1.0,Chihuahua,0.613819,328,1453
1527,678021115718029313,2015-12-19 01:16:45+00:00,This is Reese. He likes holding hands. 12/10 https://t.co/cbLroGCbmh,https://twitter.com/dog_rates/status/678021115718029313/photo/1,12.0,10.0,reese,Twitter for iPhone,,https://pbs.twimg.com/media/CWjQm5gXAAA9GkD.jpg,1.0,miniature_pinscher,0.822048,5650,12405
1528,677961670166224897,2015-12-18 21:20:32+00:00,This is Izzy. She's showing off the dance moves she's been working on. 11/10 I guess hard work pays off https://t.co/4JS92YAxTi,https://vine.co/v/iKuMDuYV0aZ,11.0,10.0,izzy,Vine - Make a Scene,,,,,,1529,3148
1529,677918531514703872,2015-12-18 18:29:07+00:00,"""Everything looks pretty good in there. Make sure to brush your gums. Been flossing? How's school going?"" Both 10/10 https://t.co/lWL2IMJqLR",https://twitter.com/dog_rates/status/677918531514703872/photo/1,10.0,10.0,none,Twitter for iPhone,,https://pbs.twimg.com/media/CWhzTbzWUAAEAUN.jpg,1.0,Eskimo_dog,0.199347,365,1221
1530,677895101218201600,2015-12-18 16:56:01+00:00,Guys this was terrifying. Really spooked me up. We don't rate ghosts. We rate dogs. Please only send dogs... 9/10 https://t.co/EJImi1udYb,https://twitter.com/dog_rates/status/677895101218201600/photo/1,9.0,10.0,none,Twitter for iPhone,,https://pbs.twimg.com/media/CWhd_7WWsAAaqWG.jpg,1.0,dalmatian,0.550702,1847,4403
1531,677716515794329600,2015-12-18 05:06:23+00:00,IT'S PUPPERGEDDON. Total of 144/120 ...I think https://t.co/ZanVtAtvIq,https://twitter.com/dog_rates/status/677716515794329600/photo/1,12.0,10.0,none,Twitter for iPhone,,https://pbs.twimg.com/media/CWe7kw9W4AE8UJh.jpg,1.0,chow,0.0254378,882,2794
1532,677700003327029250,2015-12-18 04:00:46+00:00,This is Ralph. He's an interpretive dancer. 10/10 https://t.co/zoDdPyPFsa,https://twitter.com/dog_rates/status/677700003327029250/photo/1,10.0,10.0,ralph,Twitter for iPhone,,https://pbs.twimg.com/media/CWesj06W4AAIKl8.jpg,1.0,Siberian_husky,0.120849,1297,3119
1533,677698403548192770,2015-12-18 03:54:25+00:00,This is Sadie. She got her holidays confused. 9/10 damn it Sadie https://t.co/fm7HxOsuPK,https://twitter.com/dog_rates/status/677698403548192770/photo/1,9.0,10.0,sadie,Twitter for iPhone,,https://pbs.twimg.com/media/CWerGmOXAAAm6NY.jpg,1.0,Shih-Tzu,0.916645,289,1119
1534,677687604918272002,2015-12-18 03:11:30+00:00,This was Cindy's face when she heard Susan forgot the snacks for after the kid's soccer game. 11/10 https://t.co/gzkuVGRgAD,https://twitter.com/dog_rates/status/677687604918272002/photo/1,11.0,10.0,none,Twitter for iPhone,,https://pbs.twimg.com/media/CWehRdEWIAAySyO.jpg,1.0,Pembroke,0.573047,759,2265
1535,677673981332312066,2015-12-18 02:17:22+00:00,Endangered triangular pup here. Could be a wizard. Caught mid-laugh. No legs. Just fluff. Probably a wizard. 9/10 https://t.co/GFVIHIod0Z,https://twitter.com/dog_rates/status/677673981332312066/photo/1,9.0,10.0,none,Twitter for iPhone,,https://pbs.twimg.com/media/CWeU5LBWEAA8F0J.jpg,1.0,Maltese_dog,0.817908,1353,3039
1536,677662372920729601,2015-12-18 01:31:14+00:00,"In honor of the new Star Wars movie. Here's Yoda pug. 12/10 pet really well, would I https://t.co/pvjdRn00XH",https://twitter.com/dog_rates/status/677662372920729601/photo/1,12.0,10.0,none,Twitter for iPhone,,,,,,845,1778
1537,677644091929329666,2015-12-18 00:18:36+00:00,This is a dog swinging. I really enjoyed it so I hope you all do as well. 11/10 https://t.co/Ozo9KHTRND,https://twitter.com/dog_rates/status/677644091929329666/video/1,11.0,10.0,a,Twitter for iPhone,,https://pbs.twimg.com/ext_tw_video_thumb/677644010865999872/pu/img/zVHEMYnJKzq1SauT.jpg,1.0,Chihuahua,0.626236,728,1714
1538,677573743309385728,2015-12-17 19:39:03+00:00,This is Sandy. He's sexually confused. Thinks he's a pigeon. Also an All-American cheese catcher. 10/10 so petable https://t.co/Htu8plSqEu,"https://twitter.com/dog_rates/status/677573743309385728/photo/1,https://twitter.com/dog_rates/status/677573743309385728/photo/1",10.0,10.0,sandy,Twitter for iPhone,,,,,,601,1941
1539,677565715327688705,2015-12-17 19:07:09+00:00,Contortionist pup here. Inside pentagram. Clearly worships Satan. Known to slowly push fragile stuff off tables 6/10 https://t.co/EX9oR55VMe,https://twitter.com/dog_rates/status/677565715327688705/photo/1,6.0,10.0,none,Twitter for iPhone,,https://pbs.twimg.com/media/CWcybBmWcAAigAQ.jpg,1.0,basset,0.397295,414,1195
1540,677557565589463040,2015-12-17 18:34:46+00:00,Reckless pupper here. Not even looking at road. Absolute menace. No regard for fellow pupper lives. 10/10 still cute https://t.co/96IBkOYB7j,https://twitter.com/dog_rates/status/677557565589463040/photo/1,10.0,10.0,none,Twitter for iPhone,pupper,https://pbs.twimg.com/media/CWcrAVQWEAA6QMp.jpg,1.0,Shih-Tzu,0.249017,1021,2232
1541,677547928504967168,2015-12-17 17:56:29+00:00,Not much to say here. I just think everyone needs to see this. 12/10 https://t.co/AGag0hFHpe,https://twitter.com/dog_rates/status/677547928504967168/photo/1,12.0,10.0,none,Twitter for iPhone,,https://pbs.twimg.com/media/CWciPonWEAUOqLD.jpg,1.0,American_Staffordshire_terrier,0.914978,3304,6340
1542,677530072887205888,2015-12-17 16:45:31+00:00,Say hello to Axel. He's a Black Chevy Pinot on wheels. 0 to 60 in 5.7 seconds (if downhill). 9/10 I call shotgun https://t.co/DKe9DBnnHE,https://twitter.com/dog_rates/status/677530072887205888/photo/1,9.0,10.0,axel,Twitter for iPhone,,https://pbs.twimg.com/media/CWcSAI-WUAAOB9W.jpg,1.0,Staffordshire_bullterrier,0.6892590000000001,204,970
1543,677335745548390400,2015-12-17 03:53:20+00:00,Downright inspiring 12/10 https://t.co/vSLtYBWHcQ,https://vine.co/v/hbLbH77Ar67,12.0,10.0,none,Vine - Make a Scene,,,,,,1556,2768
1544,677334615166730240,2015-12-17 03:48:51+00:00,This dog gave up mid jump. 9/10 https://t.co/KmMv3Y2zI8,"https://twitter.com/dog_rates/status/677334615166730240/photo/1,https://twitter.com/dog_rates/status/677334615166730240/photo/1",9.0,10.0,none,Twitter for iPhone,,https://pbs.twimg.com/media/CWZgPPUWUAAUOvu.jpg,2.0,Lakeland_terrier,0.859392,253,1229
1545,677331501395156992,2015-12-17 03:36:28+00:00,Meet Humphrey. He's a Northern Polyp Viagra. One ear works. Face stuck like that. Always surprised. 9/10 petable af https://t.co/FS7eJQM2F4,https://twitter.com/dog_rates/status/677331501395156992/photo/1,9.0,10.0,humphrey,Twitter for iPhone,,https://pbs.twimg.com/media/CWZdaGxXAAAjGjb.jpg,1.0,beagle,0.3134639999999999,211,990
1546,677328882937298944,2015-12-17 03:26:04+00:00,This is Derek. All the dogs adore Derek. He's a great guy. 10/10 really solid pup https://t.co/KgcsGNb61s,https://twitter.com/dog_rates/status/677328882937298944/photo/1,10.0,10.0,derek,Twitter for iPhone,,https://pbs.twimg.com/media/CWZbBlAUsAAjRg5.jpg,1.0,kelpie,0.0290541,1353,3348
1547,677314812125323265,2015-12-17 02:30:09+00:00,"Meet Tassy &amp; Bee. Tassy is pretty chill, but Bee is convinced the Ruffles are haunted. 10/10 &amp; 11/10 respectively https://t.co/fgORpmTN9C","https://twitter.com/dog_rates/status/677314812125323265/photo/1,https://twitter.com/dog_rates/status/677314812125323265/photo/1",10.0,10.0,tassy,Twitter for iPhone,,https://pbs.twimg.com/media/CWZOOIUW4AAQrX_.jpg,2.0,Blenheim_spaniel,0.924127,473,1505
1548,677301033169788928,2015-12-17 01:35:24+00:00,This is Juckson. He's totally on his way to a nascar race. 5/10 for Juckson https://t.co/IoLRvF0Kak,https://twitter.com/dog_rates/status/677301033169788928/photo/1,5.0,10.0,juckson,Twitter for iPhone,,https://pbs.twimg.com/media/CWZBsjPWsAAZFFl.jpg,1.0,Japanese_spaniel,0.6611779999999999,356,1117
1549,677269281705472000,2015-12-16 23:29:14+00:00,This is the happiest pupper I've ever seen. 10/10 would trade lives with https://t.co/ep8ATEJwRb,https://twitter.com/dog_rates/status/677269281705472000/photo/1,10.0,10.0,the,Twitter for iPhone,pupper,https://pbs.twimg.com/media/CWYk0WxWoAAEwRt.jpg,1.0,Shetland_sheepdog,0.656616,637,1801
1550,677228873407442944,2015-12-16 20:48:40+00:00,Say hello to Chuq. He just wants to fit in. 11/10 https://t.co/hGkMCjZzn4,https://twitter.com/dog_rates/status/677228873407442944/photo/1,11.0,10.0,chuq,Twitter for iPhone,,,,,,1469,3217
1551,677187300187611136,2015-12-16 18:03:28+00:00,Here we see a Byzantine Rigatoni. Very aerodynamic. No eyes. Actually not windy here they just look like that. 9/10 https://t.co/gzI0m6wXRo,https://twitter.com/dog_rates/status/677187300187611136/photo/1,9.0,10.0,none,Twitter for iPhone,,https://pbs.twimg.com/media/CWXaQMBWcAAATDi.jpg,1.0,English_setter,0.282396,816,2488
1552,676975532580409345,2015-12-16 04:01:59+00:00,This is Cooper. He doesn't know how cheese works. Likes the way it feels on his face. Cheeky tongue slip. 11/10 https://t.co/j1zczS0lI5,https://twitter.com/dog_rates/status/676975532580409345/photo/1,11.0,10.0,cooper,Twitter for iPhone,,https://pbs.twimg.com/media/CWUZpydWcAAeipD.jpg,1.0,malamute,0.363257,954,2536
1553,676957860086095872,2015-12-16 02:51:45+00:00,10/10 I'd follow this dog into battle no questions asked https://t.co/ngTNXYQF0L,https://twitter.com/dog_rates/status/676957860086095872/video/1,10.0,10.0,none,Twitter for iPhone,,https://pbs.twimg.com/ext_tw_video_thumb/676957802976419840/pu/img/dCj-qlXo73A5hf6Q.jpg,1.0,Labrador_retriever,0.772423,721,2033
1554,676949632774234114,2015-12-16 02:19:04+00:00,This is Tyrus. He's a Speckled Centennial Ticonderoga. Terrified of floating red ball. Nifty bandana. 8/10 v petable https://t.co/HqM3YhCaaa,https://twitter.com/dog_rates/status/676949632774234114/photo/1,8.0,10.0,tyrus,Twitter for iPhone,,https://pbs.twimg.com/media/CWUCGMtWEAAjXnS.jpg,1.0,Welsh_springer_spaniel,0.206479,351,1191
1555,676948236477857792,2015-12-16 02:13:31+00:00,This is Karl. Karl thinks he's slick. 6/10 sneaky pup https://t.co/Lo4ALwjVh4,https://twitter.com/dog_rates/status/676948236477857792/photo/1,6.0,10.0,karl,Twitter for iPhone,,,,,,781,1963
1556,676946864479084545,2015-12-16 02:08:04+00:00,This pups goal was to get all four feet as close to each other as possible. Valiant effort 12/10 https://t.co/2mXALbgBTV,https://twitter.com/dog_rates/status/676946864479084545/photo/1,12.0,10.0,none,Twitter for iPhone,,https://pbs.twimg.com/media/CWT_lOQWUAAXPaY.jpg,1.0,Pekinese,0.752707,329,1581
1557,676942428000112642,2015-12-16 01:50:26+00:00,Who leaves the last cupcake just sitting there? 9/10 https://t.co/PWMqAoEx2a,https://twitter.com/dog_rates/status/676942428000112642/photo/1,9.0,10.0,none,Twitter for iPhone,,,,,,670,1882
