,tweet_id,timestamp,text,expanded_urls,rating_numerator,rating_denominator,name,tweet_source,dog_stage,jpg_url,img_num,dog_breed,p_conf,retweet_count,favorite_count
0,892420643555336193,2017-08-01 16:23:56+00:00,This is Phineas. He's a mystical boy. Only ever appears in the hole of a donut. 13/10 https://t.co/MgUWQ76dJU,https://twitter.com/dog_rates/status/892420643555336193/photo/1,13.0,10.0,phineas,Twitter for iPhone,,,,,,7024,33864
1,892177421306343426,2017-08-01 00:17:27+00:00,"This is Tilly. She's just checking pup on you. Hopes you're doing ok. If not, she's available for pats, snugs, boops, the whole bit. 13/10 https://t.co/0Xxu71qeIV",https://twitter.com/dog_rates/status/892177421306343426/photo/1,13.0,10.0,tilly,Twitter for iPhone,,https://pbs.twimg.com/media/DGGmoV4XsAAUL6n.jpg,1.0,Chihuahua,0.323581,5304,29364
2,891815181378084864,2017-07-31 00:18:03+00:00,This is Archie. He is a rare Norwegian Pouncing Corgo. Lives in the tall grass. You never know when one may strike. 12/10 https://t.co/wUnZnhtVJB,https://twitter.com/dog_rates/status/891815181378084864/photo/1,12.0,10.0,archie,Twitter for iPhone,,https://pbs.twimg.com/media/DGBdLU1WsAANxJ9.jpg,1.0,Chihuahua,0.716012,3488,22089
3,891689557279858688,2017-07-30 15:58:51+00:00,This is Darla. She commenced a snooze mid meal. 13/10 happens to the best of us https://t.co/tD36da7qLQ,https://twitter.com/dog_rates/status/891689557279858688/photo/1,13.0,10.0,darla,Twitter for iPhone,,https://pbs.twimg.com/media/DF_q7IAWsAEuuN8.jpg,1.0,Labrador_retriever,0.1680859999999999,7237,36991
4,891327558926688256,2017-07-29 16:00:24+00:00,"This is Franklin. He would like you to stop calling him ""cute."" He is a very fierce shark and should be respected as such. 12/10 #BarkWeek https://t.co/AtUZn91f7f","https://twitter.com/dog_rates/status/891327558926688256/photo/1,https://twitter.com/dog_rates/status/891327558926688256/photo/1",12.0,10.0,franklin,Twitter for iPhone,,https://pbs.twimg.com/media/DF6hr6BUMAAzZgT.jpg,2.0,basset,0.555712,7775,35367
5,891087950875897856,2017-07-29 00:08:17+00:00,Here we have a majestic great white breaching off South Africa's coast. Absolutely h*ckin breathtaking. 13/10 (IG: tucker_marlo) #BarkWeek https://t.co/kQ04fDDRmh,https://twitter.com/dog_rates/status/891087950875897856/photo/1,13.0,10.0,none,Twitter for iPhone,,https://pbs.twimg.com/media/DF3HwyEWsAABqE6.jpg,1.0,Chesapeake_Bay_retriever,0.425595,2605,17832
6,890971913173991426,2017-07-28 16:27:12+00:00,"Meet Jax. He enjoys ice cream so much he gets nervous around it. 13/10 help Jax enjoy more things by clicking below

https://t.co/Zr4hWfAs1H https://t.co/tVJBRMnhxl","https://gofundme.com/ydvmve-surgery-for-jax,https://twitter.com/dog_rates/status/890971913173991426/photo/1",13.0,10.0,jax,Twitter for iPhone,,https://pbs.twimg.com/media/DF1eOmZXUAALUcq.jpg,1.0,Appenzeller,0.341703,1673,10381
7,890729181411237888,2017-07-28 00:22:40+00:00,When you watch your owner call another dog a good boy but then they turn back to you and say you're a great boy. 13/10 https://t.co/v0nONBcwxq,"https://twitter.com/dog_rates/status/890729181411237888/photo/1,https://twitter.com/dog_rates/status/890729181411237888/photo/1",13.0,10.0,none,Twitter for iPhone,,https://pbs.twimg.com/media/DFyBahAVwAAhUTd.jpg,2.0,Pomeranian,0.566142,15785,56915
8,890609185150312448,2017-07-27 16:25:51+00:00,This is Zoey. She doesn't want to be one of the scary sharks. Just wants to be a snuggly pettable boatpet. 13/10 #BarkWeek https://t.co/9TwLuAGH0b,https://twitter.com/dog_rates/status/890609185150312448/photo/1,13.0,10.0,zoey,Twitter for iPhone,,https://pbs.twimg.com/media/DFwUU__XcAEpyXI.jpg,1.0,Irish_terrier,0.4875739999999999,3628,24551
9,890240255349198849,2017-07-26 15:59:51+00:00,This is Cassie. She is a college pup. Studying international doggo communication and stick theory. 14/10 so elegant much sophisticate https://t.co/t1bfwz5S2A,https://twitter.com/dog_rates/status/890240255349198849/photo/1,14.0,10.0,cassie,Twitter for iPhone,doggo,https://pbs.twimg.com/media/DFrEyVuW0AAO3t9.jpg,1.0,Pembroke,0.511319,6109,27987
10,890006608113172480,2017-07-26 00:31:25+00:00,This is Koda. He is a South Australian deckshark. Deceptively deadly. Frighteningly majestic. 13/10 would risk a petting #BarkWeek https://t.co/dVPW0B0Mme,"https://twitter.com/dog_rates/status/890006608113172480/photo/1,https://twitter.com/dog_rates/status/890006608113172480/photo/1",13.0,10.0,koda,Twitter for iPhone,,https://pbs.twimg.com/media/DFnwSY4WAAAMliS.jpg,1.0,Samoyed,0.957979,6159,27070
11,889880896479866881,2017-07-25 16:11:53+00:00,This is Bruno. He is a service shark. Only gets out of the water to assist you. 13/10 terrifyingly good boy https://t.co/u1XPQMl29g,https://twitter.com/dog_rates/status/889880896479866881/photo/1,13.0,10.0,bruno,Twitter for iPhone,,https://pbs.twimg.com/media/DFl99B1WsAITKsg.jpg,1.0,French_bulldog,0.377417,4175,24602
12,889665388333682689,2017-07-25 01:55:32+00:00,Here's a puppo that seems to be on the fence about something haha no but seriously someone help her. 13/10 https://t.co/BxvuXk0UCm,https://twitter.com/dog_rates/status/889665388333682689/photo/1,13.0,10.0,none,Twitter for iPhone,puppo,https://pbs.twimg.com/media/DFi579UWsAAatzw.jpg,1.0,Pembroke,0.966327,8361,42099
13,889638837579907072,2017-07-25 00:10:02+00:00,This is Ted. He does his best. Sometimes that's not enough. But it's ok. 12/10 would assist https://t.co/f8dEDcrKSR,"https://twitter.com/dog_rates/status/889638837579907072/photo/1,https://twitter.com/dog_rates/status/889638837579907072/photo/1",12.0,10.0,ted,Twitter for iPhone,,https://pbs.twimg.com/media/DFihzFfXsAYGDPR.jpg,1.0,French_bulldog,0.99165,3722,23714
14,889531135344209921,2017-07-24 17:02:04+00:00,This is Stuart. He's sporting his favorite fanny pack. Secretly filled with bones only. 13/10 puppared puppo #BarkWeek https://t.co/y70o6h3isq,https://twitter.com/dog_rates/status/889531135344209921/photo/1,13.0,10.0,stuart,Twitter for iPhone,puppo,https://pbs.twimg.com/media/DFg_2PVW0AEHN3p.jpg,1.0,golden_retriever,0.953442,1885,13363
15,889278841981685760,2017-07-24 00:19:32+00:00,This is Oliver. You're witnessing one of his many brutal attacks. Seems to be playing with his victim. 13/10 fr*ckin frightening #BarkWeek https://t.co/WpHvrQedPb,https://twitter.com/dog_rates/status/889278841981685760/video/1,13.0,10.0,oliver,Twitter for iPhone,,https://pbs.twimg.com/ext_tw_video_thumb/889278779352338437/pu/img/VlbFB3v8H8VwzVNY.jpg,1.0,whippet,0.626152,4450,22154
16,888917238123831296,2017-07-23 00:22:39+00:00,This is Jim. He found a fren. Taught him how to sit like the good boys. 12/10 for both https://t.co/chxruIOUJN,https://twitter.com/dog_rates/status/888917238123831296/photo/1,12.0,10.0,jim,Twitter for iPhone,,https://pbs.twimg.com/media/DFYRgsOUQAARGhO.jpg,1.0,golden_retriever,0.714719,3771,25682
17,888804989199671297,2017-07-22 16:56:37+00:00,This is Zeke. He has a new stick. Very proud of it. Would like you to throw it for him without taking it. 13/10 would do my best https://t.co/HTQ77yNQ5K,"https://twitter.com/dog_rates/status/888804989199671297/photo/1,https://twitter.com/dog_rates/status/888804989199671297/photo/1",13.0,10.0,zeke,Twitter for iPhone,,https://pbs.twimg.com/media/DFWra-3VYAA2piG.jpg,1.0,golden_retriever,0.46976,3545,22502
18,888554962724278272,2017-07-22 00:23:06+00:00,This is Ralphus. He's powering up. Attempting maximum borkdrive. 13/10 inspirational af https://t.co/YnYAFCTTiK,"https://twitter.com/dog_rates/status/888554962724278272/photo/1,https://twitter.com/dog_rates/status/888554962724278272/photo/1,https://twitter.com/dog_rates/status/888554962724278272/photo/1,https://twitter.com/dog_rates/status/888554962724278272/photo/1",13.0,10.0,ralphus,Twitter for iPhone,,https://pbs.twimg.com/media/DFTH_O-UQAACu20.jpg,3.0,Siberian_husky,0.700377,2882,17343
19,888078434458587136,2017-07-20 16:49:33+00:00,This is Gerald. He was just told he didn't get the job he interviewed for. A h*ckin injustice. 12/10 didn't want the job anyway https://t.co/DK7iDPfuRX,"https://twitter.com/dog_rates/status/888078434458587136/photo/1,https://twitter.com/dog_rates/status/888078434458587136/photo/1",12.0,10.0,gerald,Twitter for iPhone,,https://pbs.twimg.com/media/DFMWn56WsAAkA7B.jpg,1.0,French_bulldog,0.995026,2901,19175
20,887705289381826560,2017-07-19 16:06:48+00:00,This is Jeffrey. He has a monopoly on the pool noodles. Currently running a 'boop for two' midweek sale. 13/10 h*ckin strategic https://t.co/PhrUk20Q64,https://twitter.com/dog_rates/status/887705289381826560/photo/1,13.0,10.0,jeffrey,Twitter for iPhone,,https://pbs.twimg.com/media/DFHDQBbXgAEqY7t.jpg,1.0,basset,0.821664,4542,26665
21,887517139158093824,2017-07-19 03:39:09+00:00,I've yet to rate a Venezuelan Hover Wiener. This is such an honor. 14/10 paw-inspiring af (IG: roxy.thedoxy) https://t.co/20VrLAA8ba,https://twitter.com/dog_rates/status/887517139158093824/video/1,14.0,10.0,such,Twitter for iPhone,,,,,,9865,40784
22,887473957103951883,2017-07-19 00:47:34+00:00,This is Canela. She attempted some fancy porch pics. They were unsuccessful. 13/10 someone help her https://t.co/cLyzpcUcMX,"https://twitter.com/dog_rates/status/887473957103951883/photo/1,https://twitter.com/dog_rates/status/887473957103951883/photo/1",13.0,10.0,canela,Twitter for iPhone,,https://pbs.twimg.com/media/DFDw2tyUQAAAFke.jpg,2.0,Pembroke,0.809197,15056,60266
23,887343217045368832,2017-07-18 16:08:03+00:00,You may not have known you needed to see this today. 13/10 please enjoy (IG: emmylouroo) https://t.co/WZqNqygEyV,https://twitter.com/dog_rates/status/887343217045368832/video/1,13.0,10.0,none,Twitter for iPhone,,https://pbs.twimg.com/ext_tw_video_thumb/887343120832229379/pu/img/6HSuFrW1lzI_9Mht.jpg,1.0,Mexican_hairless,0.330741,8822,29619
24,887101392804085760,2017-07-18 00:07:08+00:00,This... is a Jubilant Antarctic House Bear. We only rate dogs. Please only send dogs. Thank you... 12/10 would suffocate in floof https://t.co/4Ad1jzJSdp,https://twitter.com/dog_rates/status/887101392804085760/photo/1,12.0,10.0,none,Twitter for iPhone,,https://pbs.twimg.com/media/DE-eAq6UwAA-jaE.jpg,1.0,Samoyed,0.733942,4999,27007
25,886983233522544640,2017-07-17 16:17:36+00:00,This is Maya. She's very shy. Rarely leaves her cup. 13/10 would find her an environment to thrive in https://t.co/I6oNy0CgiT,"https://twitter.com/dog_rates/status/886983233522544640/photo/1,https://twitter.com/dog_rates/status/886983233522544640/photo/1",13.0,10.0,maya,Twitter for iPhone,,https://pbs.twimg.com/media/DE8yicJW0AAAvBJ.jpg,2.0,Chihuahua,0.793469,6329,30434
26,886736880519319552,2017-07-16 23:58:41+00:00,"This is Mingus. He's a wonderful father to his smol pup. Confirmed 13/10, but he needs your help

https://t.co/bVi0Yr4Cff https://t.co/ISvKOSkd5b","https://www.gofundme.com/mingusneedsus,https://twitter.com/dog_rates/status/886736880519319552/photo/1,https://twitter.com/dog_rates/status/886736880519319552/photo/1",13.0,10.0,mingus,Twitter for iPhone,,https://pbs.twimg.com/media/DE5Se8FXcAAJFx4.jpg,1.0,kuvasz,0.309706,2635,10511
27,886680336477933568,2017-07-16 20:14:00+00:00,This is Derek. He's late for a dog meeting. 13/10 pet...al to the metal https://t.co/BCoWue0abA,https://twitter.com/dog_rates/status/886680336477933568/photo/1,13.0,10.0,derek,Twitter for iPhone,,,,,,3746,19768
28,886366144734445568,2017-07-15 23:25:31+00:00,This is Roscoe. Another pupper fallen victim to spontaneous tongue ejections. Get the BlepiPen immediate. 12/10 deep breaths Roscoe https://t.co/RGE08MIJox,"https://twitter.com/dog_rates/status/886366144734445568/photo/1,https://twitter.com/dog_rates/status/886366144734445568/photo/1",12.0,10.0,roscoe,Twitter for iPhone,pupper,https://pbs.twimg.com/media/DE0BTnQUwAApKEH.jpg,1.0,French_bulldog,0.999201,2635,18569
29,886258384151887873,2017-07-15 16:17:19+00:00,This is Waffles. His doggles are pupside down. Unsure how to fix. 13/10 someone assist Waffles https://t.co/xZDA9Qsq1O,https://twitter.com/dog_rates/status/886258384151887873/photo/1,13.0,10.0,waffles,Twitter for iPhone,,https://pbs.twimg.com/media/DEyfTG4UMAE4aE9.jpg,1.0,pug,0.943575,5298,24554
30,885984800019947520,2017-07-14 22:10:11+00:00,Viewer discretion advised. This is Jimbo. He will rip ur finger right h*ckin off. Other dog clearly an accessory. 12/10 pls pet with caution https://t.co/BuveP0uMF1,https://twitter.com/dog_rates/status/885984800019947520/photo/1,12.0,10.0,jimbo,Twitter for iPhone,,https://pbs.twimg.com/media/DEumeWWV0AA-Z61.jpg,1.0,Blenheim_spaniel,0.972494,5626,28646
31,885528943205470208,2017-07-13 15:58:47+00:00,This is Maisey. She fell asleep mid-excavation. Happens to the best of us. 13/10 would pat noggin approvingly https://t.co/tp1kQ8i9JF,https://twitter.com/dog_rates/status/885528943205470208/photo/1,13.0,10.0,maisey,Twitter for iPhone,,https://pbs.twimg.com/media/DEoH3yvXgAAzQtS.jpg,1.0,pug,0.369275,5340,31635
32,885518971528720385,2017-07-13 15:19:09+00:00,I have a new hero and his name is Howard. 14/10 https://t.co/gzLHboL7Sk,https://twitter.com/4bonds2carbon/status/885517367337512960,14.0,10.0,none,Twitter for iPhone,,,,,,3115,18035
33,885167619883638784,2017-07-12 16:03:00+00:00,Here we have a corgi undercover as a malamute. Pawbably doing important investigative work. Zero control over tongue happenings. 13/10 https://t.co/44ItaMubBf,"https://twitter.com/dog_rates/status/885167619883638784/photo/1,https://twitter.com/dog_rates/status/885167619883638784/photo/1,https://twitter.com/dog_rates/status/885167619883638784/photo/1,https://twitter.com/dog_rates/status/885167619883638784/photo/1",13.0,10.0,none,Twitter for iPhone,,https://pbs.twimg.com/media/DEi_N9qXYAAgEEw.jpg,4.0,malamute,0.8124819999999999,3673,19284
34,884925521741709313,2017-07-12 00:01:00+00:00,"This is Earl. He found a hat. Nervous about what you think of it. 12/10 it's delightful, Earl https://t.co/MYJvdlNRVa",https://twitter.com/dog_rates/status/884925521741709313/photo/1,12.0,10.0,earl,Twitter for iPhone,,https://pbs.twimg.com/media/DEfjEaNXkAAtPlj.jpg,1.0,Italian_greyhound,0.259916,15054,67406
35,884876753390489601,2017-07-11 20:47:12+00:00,This is Lola. It's her first time outside. Must test the earth and taste the atmosphere. 13/10 you're doing great Lola https://t.co/74TKAUsLkO,"https://twitter.com/dog_rates/status/884876753390489601/photo/1,https://twitter.com/dog_rates/status/884876753390489601/photo/1,https://twitter.com/dog_rates/status/884876753390489601/photo/1,https://twitter.com/dog_rates/status/884876753390489601/photo/1",13.0,10.0,lola,Twitter for iPhone,,https://pbs.twimg.com/media/DEe2tZXXkAAwyX3.jpg,1.0,chow,0.822103,4679,24423
36,884562892145688576,2017-07-11 00:00:02+00:00,This is Kevin. He's just so happy. 13/10 what is your secret Kevin https://t.co/1r4MFCbCX5,https://twitter.com/dog_rates/status/884562892145688576/photo/1,13.0,10.0,kevin,Twitter for iPhone,,https://pbs.twimg.com/media/DEaZQkfXUAEC7qB.jpg,1.0,pug,0.5464060000000001,3918,21354
37,884441805382717440,2017-07-10 15:58:53+00:00,"I present to you, Pup in Hat. Pup in Hat is great for all occasions. Extremely versatile. Compact as h*ck. 14/10 (IG: itselizabethgales) https://t.co/vvBOcC2VdC",https://twitter.com/dog_rates/status/884441805382717440/photo/1,14.0,10.0,none,Twitter for iPhone,,https://pbs.twimg.com/media/DEYrIZwWsAA2Wo5.jpg,1.0,Pembroke,0.993225,4802,23885
38,884247878851493888,2017-07-10 03:08:17+00:00,OMG HE DIDN'T MEAN TO HE WAS JUST TRYING A LITTLE BARKOUR HE'S SUPER SORRY 13/10 WOULD FORGIVE IMMEDIATE https://t.co/uF3pQ8Wubj,https://twitter.com/kaijohnson_19/status/883965650754039809,13.0,10.0,none,Twitter for iPhone,,,,,,16944,63425
39,884162670584377345,2017-07-09 21:29:42+00:00,Meet Yogi. He doesn't have any important dog meetings today he just enjoys looking his best at all times. 12/10 for dangerously dapper doggo https://t.co/YSI00BzTBZ,https://twitter.com/dog_rates/status/884162670584377345/photo/1,12.0,10.0,yogi,Twitter for iPhone,doggo,https://pbs.twimg.com/media/DEUtQbzW0AUTv_o.jpg,1.0,German_shepherd,0.707046,2511,17967
40,883838122936631299,2017-07-09 00:00:04+00:00,This is Noah. He can't believe someone made this mess. Got the vacuum out for you though. Offered to help clean pup. 12/10 super good boy https://t.co/V85xujjDDY,https://twitter.com/dog_rates/status/883838122936631299/photo/1,12.0,10.0,noah,Twitter for iPhone,,https://pbs.twimg.com/media/DEQGFgAXUAAEvfi.jpg,1.0,Doberman,0.610946,2867,19204
41,883482846933004288,2017-07-08 00:28:19+00:00,"This is Bella. She hopes her smile made you smile. If not, she is also offering you her favorite monkey. 13.5/10 https://t.co/qjrljjt948","https://twitter.com/dog_rates/status/883482846933004288/photo/1,https://twitter.com/dog_rates/status/883482846933004288/photo/1",13.5,10.0,bella,Twitter for iPhone,,https://pbs.twimg.com/media/DELC9dZXUAADqUk.jpg,1.0,golden_retriever,0.943082,8282,40260
42,883360690899218434,2017-07-07 16:22:55+00:00,Meet Grizzwald. He may be the floofiest floofer I ever did see. Lost eyes saving a schoolbus from a volcano erpuption. 13/10 heroic as h*ck https://t.co/rf661IFEYP,https://twitter.com/dog_rates/status/883360690899218434/photo/1,13.0,10.0,grizzwald,Twitter for iPhone,floofer,https://pbs.twimg.com/media/DEJT3FeXoAAtwUy.jpg,1.0,chow,0.987997,3089,19974
43,883117836046086144,2017-07-07 00:17:54+00:00,"Please only send dogs. We don't rate mechanics, no matter how h*ckin good. Thank you... 13/10 would sneak a pat https://t.co/Se5fZ9wp5E","https://twitter.com/dog_rates/status/883117836046086144/photo/1,https://twitter.com/dog_rates/status/883117836046086144/photo/1",13.0,10.0,none,Twitter for iPhone,,https://pbs.twimg.com/media/DEF2-_hXoAAs62q.jpg,2.0,golden_retriever,0.949562,5545,32552
44,882992080364220416,2017-07-06 15:58:11+00:00,This is Rusty. He wasn't ready for the first pic. Clearly puppared for the second. 13/10 confirmed great boy https://t.co/tyER0KpdXj,"https://twitter.com/dog_rates/status/882992080364220416/photo/1,https://twitter.com/dog_rates/status/882992080364220416/photo/1",13.0,10.0,rusty,Twitter for iPhone,,https://pbs.twimg.com/media/DEEEnIqXYAAiJh_.jpg,1.0,Eskimo_dog,0.4667779999999999,3250,21011
45,882762694511734784,2017-07-06 00:46:41+00:00,This is Gus. He's quite the cheeky pupper. Already perfected the disinterested wink. 12/10 would let steal my girl https://t.co/D43I96SlVu,https://twitter.com/dog_rates/status/882762694511734784/photo/1,12.0,10.0,gus,Twitter for iPhone,pupper,https://pbs.twimg.com/media/DEAz_HHXsAA-p_z.jpg,1.0,Labrador_retriever,0.85005,4106,24832
46,882627270321602560,2017-07-05 15:48:34+00:00,This is Stanley. He has his first swim lesson today. Doggle straps adjusted. Ready to go. 13/10 Phelps is nervous (IG: stanleythe_corgi) https://t.co/Nx52PGwH94,https://twitter.com/dog_rates/status/882627270321602560/photo/1,13.0,10.0,stanley,Twitter for iPhone,,https://pbs.twimg.com/media/DD-40X3WAAAJPU5.jpg,1.0,Pembroke,0.542982,5076,24636
47,882268110199369728,2017-07-04 16:01:23+00:00,This is Alfy. You're witnessing his first watermelon experience. I think it was a success. 13/10 happy 4th Alfy ðŸ‡ºðŸ‡¸ https://t.co/fYP5RlutfA,"https://twitter.com/dog_rates/status/882268110199369728/photo/1,https://twitter.com/dog_rates/status/882268110199369728/photo/1,https://twitter.com/dog_rates/status/882268110199369728/photo/1",13.0,10.0,alfy,Twitter for iPhone,,https://pbs.twimg.com/media/DD5yKdPW0AArzX8.jpg,1.0,golden_retriever,0.762211,9652,39246
48,882045870035918850,2017-07-04 01:18:17+00:00,"This is Koko. Her owner, inspired by Barney, recently built a cart for her to use during walks if she got tired. 13/10 rest easy Koko https://t.co/zeDpnsKX7w","https://twitter.com/dog_rates/status/882045870035918850/photo/1,https://twitter.com/dog_rates/status/882045870035918850/photo/1,https://twitter.com/dog_rates/status/882045870035918850/photo/1,https://twitter.com/dog_rates/status/882045870035918850/photo/1",13.0,10.0,koko,Twitter for iPhone,,https://pbs.twimg.com/media/DD2oCl2WAAEI_4a.jpg,1.0,golden_retriever,0.00694063,4092,25766
49,881906580714921986,2017-07-03 16:04:48+00:00,This is Rey. He's a Benebop Cumberfloof. 12/10 dangerously pettable https://t.co/503CgWbhxQ,https://twitter.com/dog_rates/status/881906580714921986/photo/1,12.0,10.0,rey,Twitter for iPhone,,https://pbs.twimg.com/media/DD0pWm9XcAAeSBL.jpg,1.0,Weimaraner,0.291539,2858,21466
50,881666595344535552,2017-07-03 00:11:11+00:00,This is Gary. He couldn't miss this puppertunity for a selfie. Flawless focusing skills. 13/10 would boop intensely https://t.co/7CSWCl8I6s,https://twitter.com/dog_rates/status/881666595344535552/photo/1,13.0,10.0,gary,Twitter for iPhone,,https://pbs.twimg.com/media/DDxPFwbWAAEbVVR.jpg,1.0,Saluki,0.529012,8973,44606
51,881536004380872706,2017-07-02 15:32:16+00:00,"Here is a pupper approaching maximum borkdrive. Zooming at never before seen speeds. 14/10 paw-inspiring af 
(IG: puffie_the_chow) https://t.co/ghXBIIeQZF",https://twitter.com/dog_rates/status/881536004380872706/video/1,14.0,10.0,a,Twitter for iPhone,pupper,https://pbs.twimg.com/ext_tw_video_thumb/881535971568889856/pu/img/9bawiZ--8FKywTkz.jpg,1.0,Samoyed,0.281463,13426,43496
52,881268444196462592,2017-07-01 21:49:04+00:00,Meet Elliot. He's a Canadian Forrest Pup. Unusual number of antlers for a dog. Sneaky tongue slip to celebrate #Canada150. 12/10 would pet https://t.co/cgwJwowTMC,https://twitter.com/dog_rates/status/881268444196462592/photo/1,12.0,10.0,elliot,Twitter for iPhone,,,,,,4503,20509
53,880935762899988482,2017-06-30 23:47:07+00:00,This is Louis. He's crossing. It's a big deal. 13/10 h*ckin breathtaking https://t.co/D0wb1GlKAt,https://twitter.com/dog_rates/status/880935762899988482/photo/1,13.0,10.0,louis,Twitter for iPhone,,,,,,2337,15069
54,880872448815771648,2017-06-30 19:35:32+00:00,Ugh not again. We only rate dogs. Please don't send in well-dressed  floppy-tongued street penguins. Dogs only please. Thank you... 12/10 https://t.co/WiAMbTkDPf,https://twitter.com/dog_rates/status/880872448815771648/photo/1,12.0,10.0,none,Twitter for iPhone,,https://pbs.twimg.com/media/DDl8zzJW0AAisCJ.jpg,1.0,Pembroke,0.791416,3207,18732
55,880465832366813184,2017-06-29 16:39:47+00:00,This is Bella. She had her first beach experience this morning. Complete success. 12/10 would perform a sandy boop https://t.co/4VsFysDmiw,"https://twitter.com/dog_rates/status/880465832366813184/photo/1,https://twitter.com/dog_rates/status/880465832366813184/photo/1,https://twitter.com/dog_rates/status/880465832366813184/photo/1,https://twitter.com/dog_rates/status/880465832366813184/photo/1",12.0,10.0,bella,Twitter for iPhone,,https://pbs.twimg.com/media/DDgK-J4XUAIEV9W.jpg,1.0,golden_retriever,0.913255,5225,25053
56,880221127280381952,2017-06-29 00:27:25+00:00,Meet Jesse. He's a Fetty Woof. His tongue ejects without warning. A true bleptomaniac. 12/10 would snug well https://t.co/fUod0tVmvK,"https://twitter.com/dog_rates/status/880221127280381952/photo/1,https://twitter.com/dog_rates/status/880221127280381952/photo/1",12.0,10.0,jesse,Twitter for iPhone,,https://pbs.twimg.com/media/DDcscbXU0AIfDzs.jpg,1.0,Chihuahua,0.238525,3477,23695
57,880095782870896641,2017-06-28 16:09:20+00:00,Please don't send in photos without dogs in them. We're not @porch_rates. Insubordinate and churlish. Pretty good porch tho 11/10 https://t.co/HauE8M3Bu4,https://twitter.com/dog_rates/status/880095782870896641/photo/1,11.0,10.0,none,Twitter for iPhone,,https://pbs.twimg.com/media/DDa6ckbXgAAM1vV.jpg,1.0,miniature_pinscher,0.120298,3661,24359
58,879862464715927552,2017-06-28 00:42:13+00:00,This is Romeo. He would like to do an entrance. Requesting your immediate assistance. 13/10 https://t.co/Qh5aEkRQm9,"https://twitter.com/dog_rates/status/879862464715927552/photo/1,https://twitter.com/dog_rates/status/879862464715927552/photo/1,https://twitter.com/dog_rates/status/879862464715927552/photo/1",13.0,10.0,romeo,Twitter for iPhone,,https://pbs.twimg.com/media/DDXmPrbWAAEKMvy.jpg,3.0,basset,0.813507,2937,19725
59,879492040517615616,2017-06-27 00:10:17+00:00,This is Bailey. He thinks you should measure ear length for signs of growth instead. 12/10 https://t.co/IxM9IMKQq8,https://twitter.com/dog_rates/status/879492040517615616/photo/1,12.0,10.0,bailey,Twitter for iPhone,,https://pbs.twimg.com/media/DDSVWMvXsAEgmMK.jpg,1.0,German_short-haired_pointer,0.479896,2631,20717
60,879415818425184262,2017-06-26 19:07:24+00:00,This is Duddles. He did an attempt. 13/10 someone help him (vid by Georgia Felici) https://t.co/UDT7ZkcTgY,https://twitter.com/dog_rates/status/879415818425184262/video/1,13.0,10.0,duddles,Twitter for iPhone,,https://pbs.twimg.com/ext_tw_video_thumb/879415784908390401/pu/img/cX7XI1TnUsseGET5.jpg,1.0,English_springer,0.383404,37510,92989
61,879376492567855104,2017-06-26 16:31:08+00:00,This is Jack AKA Stephen Furry. You're not scoring on him. Unless he slips down the slide. 12/10 would happily get blocked by https://t.co/0gOi601EAa,https://twitter.com/dog_rates/status/879376492567855104/photo/1,12.0,10.0,jack,Twitter for iPhone,,https://pbs.twimg.com/media/DDQsQGFV0AAw6u9.jpg,1.0,Labrador_retriever,0.0334961,2657,14873
62,879050749262655488,2017-06-25 18:56:45+00:00,This is Steven. He has trouble relating to other dogs. Quite shy. Neck longer than average. Tropical probably. 11/10 would still pet https://t.co/2mJCDEJWdD,https://twitter.com/dog_rates/status/879050749262655488/photo/1,11.0,10.0,steven,Twitter for iPhone,,,,,,3962,19834
63,879008229531029506,2017-06-25 16:07:47+00:00,This is Beau. That is Beau's balloon. He takes it everywhere. 13/10 would protect at all costs https://t.co/YDtpCjIPKN,https://twitter.com/dog_rates/status/879008229531029506/photo/1,13.0,10.0,beau,Twitter for iPhone,,https://pbs.twimg.com/media/DDLdUrqXYAMOVzY.jpg,1.0,vizsla,0.960513,2249,16807
